sentence_id	sentence	ref	latintext	translation	translator	sent_order	norm_sentence	norm_text	sameEdition
78624	Hortensio quod causam meam commendas valde gratum	Cic.Att.6.1.13	Hortensio quod causam meam commendas ualde gratum.	Por recomendares minha causa a Hortênsio, fico muito agradecido.	José Dejalma Dezotti	4897	hortensio quod causam meam commendas ualde gratum	hortensio quod causam meam commendas ualde gratum	TRUE
78625	de Amiano spei nihil putat esse Dionysius	Cic.Att.6.1.13	De Amiano, spei nihil putat esse Dionysius.	A respeito de Amiano, Dionísio considera não haver nenhuma esperana.	José Dejalma Dezotti	4898	de amiano spei nihil putat esse dionysius	de amiano spei nihil putat esse dionysius	TRUE
78626	Terenti nullum vestigium adgnovi	Cic.Att.6.1.13	Terenti nullum uestigium agnoui.	Não percebi nenhum vestígio de Terêncio.	José Dejalma Dezotti	4899	terenti nullum uestigium adgnoui	terenti nullum uestigium agnoui	FALSE
78627	Moeragenes certe periit	Cic.Att.6.1.13	Moeragenes certe periit;	Merágenes sem dúvida morreu;	José Dejalma Dezotti	4900	moeragenes certe periit	moeragenes certe periit	TRUE
78628	feci iter per eius possessionem in qua animal reliquum nullum est	Cic.Att.6.1.13	feci iter per eius possessionem, in qua animal reliquum nullum est.	fiz um percurso por sua propriedade e nela não resta nenhum ser vivo.	José Dejalma Dezotti	4901	feci iter per eius possessionem in qua animal reliquum nullum est	feci iter per eius possessionem in qua animal reliquum nullum est	TRUE
78629	haec non noram tum cum Democrito tuo cum locutus sum	Cic.Att.6.1.13	Haec non noram tum cum de ea re cum Democrito tuo locutus sum.	Isto eu não sabia quando falei sobre essas coisas com o teu Demócrito.	José Dejalma Dezotti	4902	haec non noram tum cum democrito tuo cum locutus sum	haec non noram tum cum de ea re cum democrito tuo locutus sum	FALSE
78630	Rhosica vasa mandavi	Cic.Att.6.1.13	Rhosica uasa mandaui.	Encarreguei as vasilhas de Roso.	José Dejalma Dezotti	4903	rhosica uasa mandaui	rhosica uasa mandaui	TRUE
78631	sed heus tu quid cogitas	Cic.Att.6.1.13	Sed heus tu, quid cogitas?	Mas olha lá\! o que estás pensando?	José Dejalma Dezotti	4904	sed heus tu quid cogitas	sed heus tu quid cogitas	TRUE
78633	in felicatis lancibus et splendidissimis canistris holusculis nos soles pascere	Cic.Att.6.1.13	In felicatis lancibus et splendidissimis canistris holusculis nos soles pascere:	Costumas nos alimentar com verdurinhas em pratos cinzelados com folhas de feto e em magníficos cestos:	José Dejalma Dezotti	4905	in felicatis lancibus et splendidissimis canistris holusculis nos soles pascere	in felicatis lancibus et splendidissimis canistris holusculis nos soles pascere	TRUE
85899	quid te in vasis fictilibus appositurum putem	Cic.Att.6.1.13	quid te in uasis fictilibus appositurum putem?	o que eu devo pensar que porás em vasilhas de barro?	José Dejalma Dezotti	4906	quid te in uasis fictilibus appositurum putem	quid te in uasis fictilibus appositurum putem	TRUE
78634	κέρας Phemio mandatum est	Cic.Att.6.1.13	κέρας Phemio mandatum est.	Uma flauta foi encarregada a Fêmio.	José Dejalma Dezotti	4907	κέρας phemio mandatum est	κρας phemio mandatum est	FALSE
85900	reperietur modo aliquid illo dignum canat	Cic.Att.6.1.13	Reperietur, modo aliquid illo dignum canat.	Será encontrada, desde que cante algo digno dela.	José Dejalma Dezotti	4908	reperietur modo aliquid illo dignum canat	reperietur modo aliquid illo dignum canat	TRUE
78635	Parthicum bellum impendet	Cic.Att.6.1.14	**14** Parthicum bellum inpendet.	**14** É iminente a guerra dos partos.	José Dejalma Dezotti	4909	parthicum bellum impendet	parthicum bellum inpendet	FALSE
78636	Cassius ineptas litteras misit	Cic.Att.6.1.14	Cassius ineptas litteras misit,	Cássio enviou uma carta inepta,	José Dejalma Dezotti	4910	cassius ineptas litteras misit	cassius ineptas litteras misit	TRUE
85901	necdum Bibuli erant adlatae	Cic.Att.6.1.14	necdum Bibuli erant adlatae;	e a de Bíbulo ainda não chegou;	José Dejalma Dezotti	4911	necdum bibuli erant adlatae	necdum bibuli erant adlatae	TRUE
78637	quibus recitatis puto fore ut aliquando commoveatur senatus	Cic.Att.6.1.14	quibus recitatis puto fore ut aliquando commoueatur senatus.	lidas essas coisas, acho que enfim o senado haverá de se mover.	José Dejalma Dezotti	4912	quibus recitatis puto fore ut aliquando commoueatur senatus	quibus recitatis puto fore ut aliquando commoueatur senatus	TRUE
78638	equidem sum in magna animi perturbatione	Cic.Att.6.1.14	Equidem sum in magna animi perturbatione.	Na verdade estou numa grande perturbação de ânimo.	José Dejalma Dezotti	4913	equidem sum in magna animi perturbatione	equidem sum in magna animi perturbatione	TRUE
78639	si ut opto non prorogatur nostrum negotium habeo Iunium et Quintilem in metu	Cic.Att.6.1.14	Si, ut opto, non prorogatur nostrum negotium, habeo Iunium et Quintilem in metu.	Se, como desejo, minha tarefa não é prorrogada, tenho junho e quintil \[julho\] em medo.	José Dejalma Dezotti	4914	si ut opto non prorogatur nostrum negotium habeo iunium et quintilem in metu	si ut opto non prorogatur nostrum negotium habeo iunium et quintilem in metu	TRUE
78640	esto	Cic.Att.6.1.14	Esto;	Seja;	José Dejalma Dezotti	4915	esto	esto	TRUE
85902	duos quidem mensis sustinebit Bibulus	Cic.Att.6.1.14	duo quidem mensis sustinebit Bibulus.	Bíbulo, na verdade, resistirá por dois meses.	José Dejalma Dezotti	4916	duos quidem mensis sustinebit bibulus	duo quidem mensis sustinebit bibulus	FALSE
78641	quid illo fiet quem reliquero praesertim si fratrem	Cic.Att.6.1.14	Quid illo fiet quem reliquero, praesertim si fratrem?	O que acontecerá com aquele que eu deixar, principalmente se é meu irmão?	José Dejalma Dezotti	4917	quid illo fiet quem reliquero praesertim si fratrem	quid illo fiet quem reliquero praesertim si fratrem	TRUE
78642	quid me autem si non tam cito decedo	Cic.Att.6.1.14	Quid me autem, si non tam cito decedo?	E comigo, se não parto tão rápido?	José Dejalma Dezotti	4918	quid me autem si non tam cito decedo	quid me autem si non tam cito decedo	TRUE
78643	Magna turba est	Cic.Att.6.1.14	Magna turba est.	É um grande problema.	José Dejalma Dezotti	4919	magna turba est	magna turba est	TRUE
78644	mihi tamen cum Deiotaro convenit ut ille in meis castris esset cum suis copiis omnibus	Cic.Att.6.1.14	Mihi tamen cum Deiotaro conuenit ut ille in meis castris esset cum suis copiis omnibus;	Para mim, contudo, convim com Dejótaro para que ele estivesse com todas as suas tropas em meu acampamento;	José Dejalma Dezotti	4920	mihi tamen cum deiotaro conuenit ut ille in meis castris esset cum suis copiis omnibus	mihi tamen cum deiotaro conuenit ut ille in meis castris esset cum suis copiis omnibus	TRUE
78645	habet autem cohortis quadringenarias nostra armatura triginta equitum duo milia	Cic.Att.6.1.14	habet autem cohortis quadringenarias nostra armatura XXX, equitum CI CI.	ele tem trinta coortes de quatrocentos homens, armadas a nosso estilo e dois mil cavaleiros.	José Dejalma Dezotti	4921	habet autem cohortis quadringenarias nostra armatura triginta equitum duo milia	habet autem cohortis quadringenarias nostra armatura xxx equitum ci ci	FALSE
78646	erit ad sustentandum quoad Pompeius veniat	Cic.Att.6.1.14	Erit ad sustentandum quoad Pompeius ueniat,	Será para resistir até que Pompeu chegue,	José Dejalma Dezotti	4922	erit ad sustentandum quoad pompeius ueniat	erit ad sustentandum quoad pompeius ueniat	TRUE
85903	qui litteris quas ad me mittit significat suum negotium illud fore	Cic.Att.6.1.14	qui litteris quas ad me mittit significat suum negotium illud fore.	ele que em uma carta que me enviou indica que aquela tarefa será sua.	José Dejalma Dezotti	4923	qui litteris quas ad me mittit significat suum negotium illud fore	qui litteris quas ad me mittit significat suum negotium illud fore	TRUE
78647	hiemant in nostra provincia Parthi	Cic.Att.6.1.14	Hiemant in nostra prouincia Parthi;	Os partos passam o inverno em nossa província;	José Dejalma Dezotti	4924	hiemant in nostra prouincia parthi	hiemant in nostra prouincia parthi	TRUE
85904	exspectatur ipse Orodes	Cic.Att.6.1.14	exspectatur ipse Orodes.	Orodes em pessoa é esperado.	José Dejalma Dezotti	4925	exspectatur ipse orodes	exspectatur ipse orodes	TRUE
78648	quid quaeris	Cic.Att.6.1.14	Quid quaeris?	O que queres?	José Dejalma Dezotti	4926	quid quaeris	quid quaeris	TRUE
78649	aliquantum est negoti	Cic.Att.6.1.14	Aliquantum est negoti.	Há bastante tarefa.	José Dejalma Dezotti	4927	aliquantum est negoti	aliquantum est negoti	TRUE
78650	de Bibuli edicto nihil novi praeter illam exceptionem de qua tu ad me scripseras	Cic.Att.6.1.15	**15** De Bibuli edicto, nihil noui praeter illam exceptionem de qua tu ad me scripseras	**15** Acerca do edito de Bíbulo, nada de novo além daquela exceção de que tu tinhas escrito a mim	José Dejalma Dezotti	4928	de bibuli edicto nihil noui praeter illam exceptionem de qua tu ad me scripseras	de bibuli edicto nihil noui praeter illam exceptionem de qua tu ad me scripseras	TRUE
89039	nimis gravi praeiudicio in ordinem nostrum	Cic.Att.6.1.15	“nimis graui praeiudicio in ordinem nostrum”.	“um prejuízo bastante grave em nossa ordem”.	José Dejalma Dezotti	4929	nimis graui praeiudicio in ordinem nostrum	nimis graui praeiudicio in ordinem nostrum	TRUE
78651	ego tamen habeo ἰσοδυναμοῦσαν sed tectiorem ex Quinti Muci Publi fili edicto Asiatico extra quam si ita negotium gestum est ut eo stari non oporteat ex fide bona multa que sum secutus Scaevolae in iis illud in quo sibi libertatem censent Graeci datam ut Graeci inter se disceptent suis legibus	Cic.Att.6.1.15	Ego tamen habeo ἰσοδυναμοῦσαν sed tectiorem ex Q. Muci P. f. edicto Asiatico, “extra quam si ita negotium gestum est ut eo stari non oporteat ex fide bona”; multaque sum secutus Scaeuolae, in iis illud in quo sibi libertatem censent Graeci datam, ut Graeci inter se disceptent suis legibus.	Eu, contudo, tenho uma *com o mesmo valor*, mas mais dissimulada, procedente do edito asiático de Quinto Múcio, filho de Públio, “exceto se a transação tenha sido realizada de tal modo que não convém mantê-la de acordo com a boa fé”; tenho seguido muitos preceitos de Cévola, entre esses aquele no qual os gregos consideram que lhes foi dada a liberdade para que os gregos decidam entre si de acordo com suas próprias leis.	José Dejalma Dezotti	4930	ego tamen habeo σοδυναμοσαν sed tectiorem ex quinti muci publi fili edicto asiatico extra quam si ita negotium gestum est ut eo stari non oporteat ex fide bona multaque sum secutus scaeuolae in iis illud in quo sibi libertatem censent graeci datam ut graeci inter se disceptent suis legibus	ego tamen habeo σοδυναμοσαν sed tectiorem ex q muci p f edicto asiatico extra quam si ita negotium gestum est ut eo stari non oporteat ex fide bona multaque sum secutus scaeuolae in iis illud in quo sibi libertatem censent graeci datam ut graeci inter se disceptent suis legibus	FALSE
78653	breve autem edictum est propter hanc meam διαίρεσιν quod duobus generibus edicendum putavi	Cic.Att.6.1.15	Breue autem edictum est propter hanc meam διαίρεσιν, quod duobus generibus edicendum putaui;	O edito, porém, é curto devido a esta minha *divisão*, porque julguei que ele devia ser estabelecido em dois tipos:	José Dejalma Dezotti	4931	breue autem edictum est propter hanc meam διαίρεσιν quod duobus generibus edicendum putaui	breue autem edictum est propter hanc meam διαρεσιν quod duobus generibus edicendum putaui	FALSE
78654	quorum unum est provinciale in quo est de rationibus civitatum de aere alieno de usura de syngraphis	Cic.Att.6.1.15	quorum unum est prouinciale, in quo inest de rationibus ciuitatum, de aere alieno, de usura, de syngraphis,	um desses tipos é o provincial, em que estão incluídas as contas das cidades, as dívidas, os juros, os contratos	José Dejalma Dezotti	4932	quorum unum est prouinciale in quo est de rationibus ciuitatum de aere alieno de usura de syngraphis	quorum unum est prouinciale in quo inest de rationibus ciuitatum de aere alieno de usura de syngraphis	FALSE
85906	in eodem omnia de publicanis	Cic.Att.6.1.15	in eodem omnia de publicanis;	e no mesmo tudo a respeito dos publicanos;	José Dejalma Dezotti	4933	in eodem omnia de publicanis	in eodem omnia de publicanis	TRUE
85907	alterum quod sine edicto satis commode transigi non potest de hereditatum possessionibus de bonis possidendis vendendis magistris faciendis quae ex edicto et postulari et fieri solent	Cic.Att.6.1.15	alterum quod sine edicto satis commode transigi non potest, de hereditatum possessionibus, de bonis possidendis, magistris faciendis, bonis uendendis, quae ex edicto et postulari et fieri solent.	o outro, aquilo que nao pode ser levado a cabo suficientemente bem sem um edito, a possessão das heranças, a posse dos bens, a eleição dos síndicos, a venda dos bens, coisas que costumam ser demandadas e feitas a partir de um edito.	José Dejalma Dezotti	4934	alterum quod sine edicto satis commode transigi non potest de hereditatum possessionibus de bonis possidendis uendendis magistris faciendis quae ex edicto et postulari et fieri solent	alterum quod sine edicto satis commode transigi non potest de hereditatum possessionibus de bonis possidendis magistris faciendis bonis uendendis quae ex edicto et postulari et fieri solent	FALSE
78655	tertium de reliquo iure dicundo ἄγραφον reliqui	Cic.Att.6.1.15	Tertium de reliquo iure dicundo ἄγραφον reliqui.	O terceiro, acerca do restante da administração da justiça, deixei *sem escrita*.	José Dejalma Dezotti	4935	tertium de reliquo iure dicundo γραφον reliqui	tertium de reliquo iure dicundo γραφον reliqui	TRUE
78656	dixi me de eo genere mea decreta ad edicta urbana accommodaturum	Cic.Att.6.1.15	Dixi me de eo genere mea decreta ad edicta urbana accommodaturum,	Eu disse que acomodaria meus decretos desse tipo aos editos urbanos,	José Dejalma Dezotti	4936	dixi me de eo genere mea decreta ad edicta urbana accommodaturum	dixi me de eo genere mea decreta ad edicta urbana accommodaturum	TRUE
78657	itaque curo et satis facio adhuc omnibus	Cic.Att.6.1.15	itaque curo et satis facio adhuc omnibus.	e assim cuido e satisfaço até agora a todo mundo.	José Dejalma Dezotti	4937	itaque curo et satis facio adhuc omnibus	itaque curo et satis facio adhuc omnibus	TRUE
78658	Graeci vero exsultant quod peregrinis iudicibus utuntur	Cic.Att.6.1.15	Graeci uero exsultant quod peregrinis iudicibus utuntur.	Os gregos, na verdade, estão exultantes porque se utilizam de juízes estrangeiros.	José Dejalma Dezotti	4938	graeci uero exsultant quod peregrinis iudicibus utuntur	graeci uero exsultant quod peregrinis iudicibus utuntur	TRUE
78659	nugatoribus quidem	Cic.Att.6.1.15	“Nugatoribus quidem”	“Charlatães, na verdade”	José Dejalma Dezotti	4939	nugatoribus quidem	nugatoribus quidem	TRUE
85908	inquies	Cic.Att.6.1.15	inquies.	dirás.	José Dejalma Dezotti	4940	inquies	inquies	TRUE
78660	quid refert	Cic.Att.6.1.15	Quid refert?	O que importa?	José Dejalma Dezotti	4941	quid refert	quid refert	TRUE
78661	tamen se αὐτονομίαν adeptos putant	Cic.Att.6.1.15	Ii se αὐτονομίαν adeptos putant.	Eles consideram que adquiriram *autonomia*.	José Dejalma Dezotti	4942	tamen se ατονομίαν adeptos putant	ii se ατονομαν adeptos putant	FALSE
78662	vestri enim credo gravis habent Turpionem sutorium et Vettium mancipem	Cic.Att.6.1.15	Nostri enim, credo, grauis habent, Turpionem sutorium et Vettium mancipem.	Pois os nossos, creio, têm gente séria, o sapateiro Turpião e o empresário Vétio.	José Dejalma Dezotti	4943	uestri enim credo grauis habent turpionem sutorium et uettium mancipem	nostri enim credo grauis habent turpionem sutorium et uettium mancipem	FALSE
78663	de publicanis quid agam videris quaerere	Cic.Att.6.1.16	**16** De publicanis quid agam uideris quaerere.	**16** Parece que queres saber o que faço a respeito dos publicanos.	José Dejalma Dezotti	4944	de publicanis quid agam uideris quaerere	de publicanis quid agam uideris quaerere	TRUE
78664	habeo in deliciis	Cic.Att.6.1.16	Habeo in deliciis,	Tenho-os em bem-querença,	José Dejalma Dezotti	4945	habeo in deliciis	habeo in deliciis	TRUE
85909	obsequor	Cic.Att.6.1.16	obsequor,	condescendo com eles,	José Dejalma Dezotti	4946	obsequor	obsequor	TRUE
85910	verbis laudo	Cic.Att.6.1.16	uerbis laudo,	louvo-os	José Dejalma Dezotti	4947	uerbis laudo	uerbis laudo	TRUE
85911	orno	Cic.Att.6.1.16	orno:	e adorno com palavras:	José Dejalma Dezotti	4948	orno	orno	TRUE
85912	efficio ne cui molesti sint	Cic.Att.6.1.16	efficio ne cui molesti sint.	consigo que não sejam molestos a ninguém.	José Dejalma Dezotti	4949	efficio ne cui molesti sint	efficio ne cui molesti sint	TRUE
78665	τὸ παραδοξότατον usuras eorum quas pactionibus adscripserant servavit etiam Servilius	Cic.Att.6.1.16	τὸ παραδοξότατον: usuras eorum quas pactionibus adscripserant seruauit etiam Seruilius;	*O mais surpreendente:* os juros que eles tinham especificados nos contratos até Servílio manteve;	José Dejalma Dezotti	4950	τ παραδοξτατον usuras eorum quas pactionibus adscripserant seruauit etiam seruilius	τ παραδοξτατον usuras eorum quas pactionibus adscripserant seruauit etiam seruilius	TRUE
78666	ego sic	Cic.Att.6.1.16	ego sic:	eu assim:	José Dejalma Dezotti	4951	ego sic	ego sic	TRUE
78667	diem statuo satis laxam quam ante si solverint dico me centesimas ducturum	Cic.Att.6.1.16	diem statuo satis laxam, quam ante si soluerint, dico me centesimas ducturum,	estabeleço um prazo bastante amplo, se pagarem antes desse, digo que considerarei um por cento ao mês;	José Dejalma Dezotti	4952	diem statuo satis laxam quam ante si soluerint dico me centesimas ducturum	diem statuo satis laxam quam ante si soluerint dico me centesimas ducturum	TRUE
85913	si non solverint ex pactione	Cic.Att.6.1.16	si non soluerint, ex pactione.	se não pagarem, será de acordo com o contrato.	José Dejalma Dezotti	4953	si non soluerint ex pactione	si non soluerint ex pactione	TRUE
78668	itaque et Graeci solvunt tolerabili faenore et publicanis res est gratissima si illa iam habent pleno modio verborum honorem invitationem crebram	Cic.Att.6.1.16	Itaque et Graeci soluunt tolerabili faenore et publicanis res est gratissima, si illa iam habent pleno modio, uerborum honorem, inuitationem crebram.	E assim os gregos pagam um juro tolerável e para os publicanos a situação é muito boa, pois já têm aquelas coisas com plena medida, a honra das palavras e frequente convite.	José Dejalma Dezotti	4954	itaque et graeci soluunt tolerabili faenore et publicanis res est gratissima si illa iam habent pleno modio uerborum honorem inuitationem crebram	itaque et graeci soluunt tolerabili faenore et publicanis res est gratissima si illa iam habent pleno modio uerborum honorem inuitationem crebram	TRUE
78669	quid plura	Cic.Att.6.1.16	Quid plura?	O que mais?	José Dejalma Dezotti	4955	quid plura	quid plura	TRUE
78670	sunt omnes ita mihi familiares ut se quisque maxime putet	Cic.Att.6.1.16	Sunt omnes ita mihi familiares ut se quisque maxime putet;	São todos tão amigos meus que cada um se considera o maior;	José Dejalma Dezotti	4956	sunt omnes ita mihi familiares ut se quisque maxime putet	sunt omnes ita mihi familiares ut se quisque maxime putet	TRUE
78671	sed tamen μηδὲν αὐτοῖς	Cic.Att.6.1.16	sed tamen “μηδὲν αὐτοῖς” \-	mas “*nada os...*”	José Dejalma Dezotti	4957	sed tamen μηδν ατος	sed tamen μηδν ατος \	FALSE
78672	scis reliqua	Cic.Att.6.1.16	scis reliqua.	sabes o resto.	José Dejalma Dezotti	4958	scis reliqua	scis reliqua	TRUE
78673	de statua Africani ὢ πραγμάτων ἀσυγκλώστων sed me id ipsum delectavit in tuis litteris ai n tu	Cic.Att.6.1.17	**17** De statua Africani (ὢ πραγμάτων ἀσυγκλώστων\! sed me id ipsum delectauit in tuis litteris), ain tu?	**17** Com relação à estátua do Africano (*ó assuntos mais desconexos\!* mas é precisamente isso que me deliciou em tua carta), o que tu dizes?	José Dejalma Dezotti	4959	de statua africani πραγμάτων συγκλστων sed me id ipsum delectauit in tuis litteris ai n tu	de statua africani πραγμτων συγκλστων\ sed me id ipsum delectauit in tuis litteris ain tu	FALSE
78675	Scipio hic Metellus proavum suum nescit censorem non fuisse	Cic.Att.6.1.17	Scipio hic Metellus proauum suum nescit censorem non fuisse?	Este Cipião Metelo não sabe que seu bisavô não foi censor?	José Dejalma Dezotti	4960	scipio hic metellus proauum suum nescit censorem non fuisse	scipio hic metellus proauum suum nescit censorem non fuisse	TRUE
78677	in illa autem quae est ad Πολυκλέους Herculem inscriptum est consul	Cic.Att.6.1.17	In illa autem quae est ad Πολυκλέους Herculem inscriptum est “cos. Cens.”;	Porém, naquela que está junto ao Hércules de Policles está inscrito “cos. Cens.”;	José Dejalma Dezotti	4961	in illa autem quae est ad πολυκλέους herculem inscriptum est consul	in illa autem quae est ad πολυκλους herculem inscriptum est cos cens	FALSE
85914	quam esse eiusdem status amictus anulus imago ipsa declarat	Cic.Att.6.1.17	quam esse eiusdem status, amictus, anulus, imago ipsa declarat.	e que essa estátua é do mesmo a estatura, o manto, o anel, a própria imagem indicam.	José Dejalma Dezotti	4962	quam esse eiusdem status amictus anulus imago ipsa declarat	quam esse eiusdem status amictus anulus imago ipsa declarat	TRUE
78678	at me hercule ego cum in turma inauratarum equestrium quas hic Metellus in Capitolio posuit animadvertissem in Serapionis subscriptione Africani imaginem erratum fabrile putavi	Cic.Att.6.1.17	At mehercule ego, cum in turma inauratarum equestrium quas hic Metellus in Capitolio posuit animaduertissem in Sarapionis subscriptione Africani imaginem, erratum fabrile putaui,	Mas, por hércules, eu, quando notei no esquadrão das estátuas equestres douradas que este Metelo pôs no Capitólio uma imagem do Africano com o nome de Sarapião escrito embaixo, achei que era erro do operário,	José Dejalma Dezotti	4963	at me hercule ego cum in turma inauratarum equestrium quas hic metellus in capitolio posuit animaduertissem in serapionis subscriptione africani imaginem erratum fabrile putaui	at mehercule ego cum in turma inauratarum equestrium quas hic metellus in capitolio posuit animaduertissem in sarapionis subscriptione africani imaginem erratum fabrile putaui	FALSE
85915	nunc video Metelli	Cic.Att.6.1.17	nunc uideo Metelli.	agora vejo que é de Metelo.	José Dejalma Dezotti	4964	nunc uideo metelli	nunc uideo metelli	TRUE
78679	o ἀνιστορησίαν turpem	Cic.Att.6.1.18	o ἀνιστορησίαν turpem\!	Ó vergonhoso *erro histórico*\!	José Dejalma Dezotti	4965	o νιστορησίαν turpem	o νιστορησαν turpem\	FALSE
78680	nam illud de Flavio et fastis si secus est commune erratum est et tu belle ἠπόρησας et nos publicam prope opinionem secuti sumus ut multa apud Graecos	Cic.Att.6.1.18	**18** Nam illud de Flauio et fastis, si secus est, commune erratum est; et tu belle ἠπόρησας et nos publicam prope opinionem secuti sumus, ut multa apud Graecos.	**18** Pois o de Flávio e dos fastos, se é de outro modo, é um erro comum; e tu *estavas* lindamente *em dúvida* e nós mais ou menos seguimos a opinião pública, como muitas coisas entre os gregos.	José Dejalma Dezotti	4966	nam illud de flauio et fastis si secus est commune erratum est et tu belle πρησας et nos publicam prope opinionem secuti sumus ut multa apud graecos	nam illud de flauio et fastis si secus est commune erratum est et tu belle πρησας et nos publicam prope opinionem secuti sumus ut multa apud graecos	TRUE
78681	quis enim non dixit Εὔπολιν ab Alcibiade navigante in Siciliam deiectum esse in mare	Cic.Att.6.1.18	Quis enim non dixit Εὔπολιν τὸν τῆς ἀρχαίας ab Alcibiade nauigante in Siciliam deiectum esse in mare?	Pois quem não disse que *Eupólis, o da comédia antiga*, foi atirado ao mar por Alcibíades, quando navegava para a Sicília?	José Dejalma Dezotti	4967	quis enim non dixit επολιν ab alcibiade nauigante in siciliam deiectum esse in mare	quis enim non dixit επολιν τν τς ρχαας ab alcibiade nauigante in siciliam deiectum esse in mare	FALSE
78682	redarguit Eratosthenes	Cic.Att.6.1.18	Redarguit Eratosthenes;	Eratóstenes refuta isso;	José Dejalma Dezotti	4968	redarguit eratosthenes	redarguit eratosthenes	TRUE
85916	adfert enim quas ille post id tempus fabulas docuerit	Cic.Att.6.1.18	adfert enim quas ille post id tempus fabulas docuerit.	pois apresenta as comédias que ele representou depois daquela data.	José Dejalma Dezotti	4969	adfert enim quas ille post id tempus fabulas docuerit	adfert enim quas ille post id tempus fabulas docuerit	TRUE
78683	num idcirco Duris Samius homo in historia diligens quod cum multis erravit inridetur	Cic.Att.6.1.18	Num idcirco Duris Samius, homo in historia diligens, quod cum multis errauit, irridetur?	Por acaso Dúris de Samos, homem diligente em História, é objeto de riso por que errou junto com muitos?	José Dejalma Dezotti	4970	num idcirco duris samius homo in historia diligens quod cum multis errauit inridetur	num idcirco duris samius homo in historia diligens quod cum multis errauit irridetur	FALSE
78684	quis Zaleucum leges Locris scripsisse non dixit	Cic.Att.6.1.18	Quis Zaleucum leges Locris scripsisse non dixit?	Quem não disse que Zaleuco escreveu as leis de Locros?	José Dejalma Dezotti	4971	quis zaleucum leges locris scripsisse non dixit	quis zaleucum leges locris scripsisse non dixit	TRUE
