sentence_id	sentence	ref	latintext	translation	translator	sent_order	norm_sentence	norm_text	sameEdition
78524	accepi tuas litteras a.d.quintum Terminalia Laodiceae	Cic.Att.6.1.1	**1** Accepi tuas litteras a. d. V Terminalia Laodiceae,	**1** Recebi tua carta em Laodicéia cinco dias antes das Terminais,	José Dejalma Dezotti	4772	accepi tuas litteras adquintum terminalia laodiceae	accepi tuas litteras a d u terminalia laodiceae	FALSE
85867	quas legi libentissime plenissimas amoris humanitatis offici diligentiae	Cic.Att.6.1.1	quas legi libentissime plenissimas amoris, humanitatis, offici, diligentiae.	a qual li com muitíssimo prazer, tão cheia estava ela de afeto, de humanidade, de dever, de diligência.	José Dejalma Dezotti	4773	quas legi libentissime plenissimas amoris humanitatis offici diligentiae	quas legi libentissime plenissimas amoris humanitatis offici diligentiae	TRUE
78527	iis igitur respondebo non χρύσεα χαλκείων sic enim postulas ne c οἰκονομίαν meam instituam sed ordinem conservabo tuum	Cic.Att.6.1.1	Iis igitur respondebo, (sic enim postulas), nec οἰκονομίαν meam instituam sed ordinem conseruabo tuum.	Vou, pois, respondê-la (pois assim me pedes) e não vou estabelecer o meu próprio *plano*, mas manterei a tua ordem.	José Dejalma Dezotti	4774	iis igitur respondebo non χρσεα χαλκείων sic enim postulas nec οκονομίαν meam instituam sed ordinem conseruabo tuum	iis igitur respondebo sic enim postulas nec οκονομαν meam instituam sed ordinem conseruabo tuum	FALSE
78528	recentissimas a Cybistris te meas litteras habere ais a.d.xi Kalendas Octobris datas et scire vis tuas ego quas acceperim	Cic.Att.6.1.1	Recentissimas a Cybistris te meas litteras habere ais a. d. X Kal. Oct. datas et scire uis tuas ego quas acceperim.	Dizes que tens, como carta mais recente minha, a que foi enviada de Cibistra no décimo dia antes das calendas de outubro \[22 de setembro\] e queres saber quais tuas eu recebi.	José Dejalma Dezotti	4775	recentissimas a cybistris te meas litteras habere ais adxi kalendas octobris datas et scire uis tuas ego quas acceperim	recentissimas a cybistris te meas litteras habere ais a d x kal oct datas et scire uis tuas ego quas acceperim	FALSE
78531	omnis fere quas commemoras praeter eas quas scribis Lentuli pueris et Equotutico et Brundisio datas	Cic.Att.6.1.1	Omnis fere quas commemoras, praeter eas quas scribis Lentuli pueris et quas Equo Tutico et Brundisio datas.	Quase todas que mencionas, exceto aquelas que, segundo escreves, foram entregues aos escravos de Lêntulo e as que foram enviadas de Equo Tutico e Brundísio.	José Dejalma Dezotti	4776	omnis fere quas commemoras praeter eas quas scribis lentuli pueris et equotutico et brundisio datas	omnis fere quas commemoras praeter eas quas scribis lentuli pueris et quas equo tutico et brundisio datas	FALSE
78532	qua re non οἴχεται tua industria quod vereris sed praeclare ponitur si quidem id egisti ut ego delectarer	Cic.Att.6.1.1	Qua re non οἴχεται tua industria, quod uereris, sed praeclare ponitur, si quidem id egisti, ut ego delectarer;	Por isso teu zelo não *está perdido*, como receias, mas se põe magnificamente, se na verdade fizeste isso para que eu me deleitasse;	José Dejalma Dezotti	4777	qua re non οχεται tua industria quod uereris sed praeclare ponitur si quidem id egisti ut ego delectarer	qua re non οχεται tua industria quod uereris sed praeclare ponitur si quidem id egisti ut ego delectarer	TRUE
78533	nam nulla re sum delectatus magis	Cic.Att.6.1.1	nam nulla re sum delectatus magis.	pois com nada eu me deleitei mais.	José Dejalma Dezotti	4778	nam nulla re sum delectatus magis	nam nulla re sum delectatus magis	TRUE
78534	quod meam βαθύτητα in Appio tibi liberalitatem etiam in Bruto probo vehementer gaudeo	Cic.Att.6.1.2	**2** Quod meam βαθύτητα in Appio tibi, liberalitatem etiam in Bruto probo, uehementer gaudeo;	**2** Me alegra muitíssimo que aproves minha *sagacidade* em relação a Ápio, e também a minha generosidade em relação a Bruto;	José Dejalma Dezotti	4779	quod meam βαθτητα in appio tibi liberalitatem etiam in bruto probo uehementer gaudeo	quod meam βαθτητα in appio tibi liberalitatem etiam in bruto probo uehementer gaudeo	TRUE
85868	ac putaram paulo secus	Cic.Att.6.1.2	ac putaram paulo secus.	e eu tinha pensado que ia ser um pouco diferente.	José Dejalma Dezotti	4780	ac putaram paulo secus	ac putaram paulo secus	TRUE
78535	Appius enim ad me ex itinere bis ter ve ὑπομεμψιμοίρους litteras miserat quod quaedam a se constituta rescinderem	Cic.Att.6.1.2	Appius enim ad me ex itinere bis terue ὑπομεμψιμοίρους litteras miserat quod quaedam a se constituta rescinderem.	Pois Ápio, em sua viagem, tinha enviado duas ou três cartas *cheias de queixas*, porque eu tinha anulado algumas coisas estabelecidas por ele.	José Dejalma Dezotti	4781	appius enim ad me ex itinere bis ter ue πομεμψιμοίρους litteras miserat quod quaedam a se constituta rescinderem	appius enim ad me ex itinere bis terue πομεμψιμορους litteras miserat quod quaedam a se constituta rescinderem	FALSE
78537	nihil enim a me fit cum ulla illius contumelia	Cic.Att.6.1.2	Nihil enim a me fit cum ulla illius contumelia;	Pois nada foi feito por mim com qualquer ofensa a ele;	José Dejalma Dezotti	4783	nihil enim a me fit cum ulla illius contumelia	nihil enim a me fit cum ulla illius contumelia	TRUE
85869	tantum modo dissimilitudo meae rationis offendit hominem	Cic.Att.6.1.2	tantum modo dissimilitudo meae rationis offendit hominem.	somente a diferença de meu método ofende o homem.	José Dejalma Dezotti	4784	tantum modo dissimilitudo meae rationis offendit hominem	tantum modo dissimilitudo meae rationis offendit hominem	TRUE
78538	quid enim potest esse tam dissimile quam illo imperante exhaustam esse sumptibus et iacturis provinciam nobis eam obtinentibus nummum nullum esse erogatum ne c privatim ne c publice	Cic.Att.6.1.2	Quid enim potest esse tam dissimile quam illo imperante exhaustam esse sumptibus et iacturis prouinciam, nobis eam obtinentibus nummum nullum esse erogatum nec priuatim nec publice?	Pois o que pode ser tão diferente quanto a província ter sido arruinada com gastos e despesas, enquanto ele a governava, quando nós a obtivemos, não ter sido gasta nenhuma moeda nem privadamente nem públicamente?	José Dejalma Dezotti	4785	quid enim potest esse tam dissimile quam illo imperante exhaustam esse sumptibus et iacturis prouinciam nobis eam obtinentibus nummum nullum esse erogatum nec priuatim nec publice	quid enim potest esse tam dissimile quam illo imperante exhaustam esse sumptibus et iacturis prouinciam nobis eam obtinentibus nummum nullum esse erogatum nec priuatim nec publice	TRUE
78539	quid dicam de illius praefectis comitibus legatis etiam	Cic.Att.6.1.2	Quid dicam de illius praefectis, comitibus, legatis etiam?	O que vou dizer ainda de seus prefeitos, acompanhantes, legados?	José Dejalma Dezotti	4786	quid dicam de illius praefectis comitibus legatis etiam	quid dicam de illius praefectis comitibus legatis etiam	TRUE
78540	de rapinis de libidinibus de contumeliis	Cic.Att.6.1.2	De rapinis, de libidinibus, de contumeliis?	Das rapinas, das paixões, das ofensas?	José Dejalma Dezotti	4787	de rapinis de libidinibus de contumeliis	de rapinis de libidinibus de contumeliis	TRUE
78541	nunc autem domus me hercule nulla tanto consilio aut tanta disciplina gubernatur aut tam modesta est quam nostra tota provincia	Cic.Att.6.1.2	Nunc autem domus mehercule nulla tanto consilio aut tanta disciplina gubernatur aut tam modesta est quam nostra tota prouincia.	Já agora nenhuma casa \- por hércules \- é governada com tanto juízo ou com tanta disciplina ou está tão moderada quanto a nossa província inteira.	José Dejalma Dezotti	4788	nunc autem domus me hercule nulla tanto consilio aut tanta disciplina gubernatur aut tam modesta est quam nostra tota prouincia	nunc autem domus mehercule nulla tanto consilio aut tanta disciplina gubernatur aut tam modesta est quam nostra tota prouincia	FALSE
78542	haec non nulli amici Appi ridicule interpretantur qui me idcirco putent bene audire velle ut ille male audiat et recte facere non meae laudis sed illius contumeliae causa	Cic.Att.6.1.2	Haec non nulli amici Appi ridicule interpretantur, qui me idcirco putent bene audire uelle ut ille male audiat et recte facere non meae laudis sed illius contumeliae causa.	Alguns amigos de Ápio interpretam isto de modo ridículo: eles julgam que eu, neste caso, quero ter boa fama para que ele tenha má e que ajo com retidão não para o meu louvor, mas para a sua desonra.	José Dejalma Dezotti	4789	haec non nulli amici appi ridicule interpretantur qui me idcirco putent bene audire uelle ut ille male audiat et recte facere non meae laudis sed illius contumeliae causa	haec non nulli amici appi ridicule interpretantur qui me idcirco putent bene audire uelle ut ille male audiat et recte facere non meae laudis sed illius contumeliae causa	TRUE
78543	sin Appius ut Bruti litterae quas ad te misit significabant gratias nobis agit non moleste fero sed tamen eo ipso die quo haec ante lucem scribebam cogitabam eius multa inique constituta et acta tollere	Cic.Att.6.1.2	Sin Appius, ut Bruti litterae quas ad te misit significabant, gratias nobis agit, non moleste fero, sed tamen eo ipso die quo haec ante lucem scribebam cogitabam eius multa inique constituta et acta tollere.	Mas se Ápio, como indicava a carta de Bruto, que ele enviou a ti, me agradece, não o levo a mal, mas nesse mesmo dia em que escrevo esta antes do amanhecer, penso em anular muitas coisas dele estabelecidas e realizadas de modo injusto.	José Dejalma Dezotti	4790	sin appius ut bruti litterae quas ad te misit significabant gratias nobis agit non moleste fero sed tamen eo ipso die quo haec ante lucem scribebam cogitabam eius multa inique constituta et acta tollere	sin appius ut bruti litterae quas ad te misit significabant gratias nobis agit non moleste fero sed tamen eo ipso die quo haec ante lucem scribebam cogitabam eius multa inique constituta et acta tollere	TRUE
78544	nunc venio ad Brutum quem ego omni studio te auctore sum complexus quem etiam amare coeperam sed ilico me revocavi ne te offenderem	Cic.Att.6.1.3	**3** Nunc uenio ad Brutum, quem ego omni studio te auctore sum complexus, quem etiam amare coeperam; sed plane dico, me reuocaui ne te offenderem.	**3** Agora venho a Bruto, a quem eu, a teu conselho, acolhi com todo interesse, a quem também eu tinha começado a estimar; mas digo com franqueza, voltei atrás para não te ofender.	José Dejalma Dezotti	4791	nunc uenio ad brutum quem ego omni studio te auctore sum complexus quem etiam amare coeperam sed ilico me reuocaui ne te offenderem	nunc uenio ad brutum quem ego omni studio te auctore sum complexus quem etiam amare coeperam sed plane dico me reuocaui ne te offenderem	FALSE
78545	noli enim putare me quicquam maluisse quam ut mandatis satis facerem ne c ulla de re plus laborasse	Cic.Att.6.1.3	Noli enim putare me quicquam maluisse quam ut mandatis satis facerem nec ulla de re plus laborasse.	Pois não julgues que eu tenha querido algo mais do que satisfazer os seus encargos e que em relação a nenhuma outra coisa eu tenho me esforçado mais.	José Dejalma Dezotti	4792	noli enim putare me quicquam maluisse quam ut mandatis satis facerem nec ulla de re plus laborasse	noli enim putare me quicquam maluisse quam ut mandatis satis facerem nec ulla de re plus laborasse	TRUE
78546	mandatorum autem mihi libellum dedit isdem que de rebus tu me cum egeras	Cic.Att.6.1.3	Mandatorum autem mihi libellum dedit, isdemque de rebus tu mecum egeras.	Ele, por sua vez, me deu uma lista de encargos e sobre essas mesmas coisas tu tinhas tratado comigo.	José Dejalma Dezotti	4793	mandatorum autem mihi libellum dedit isdemque de rebus tu me cum egeras	mandatorum autem mihi libellum dedit isdemque de rebus tu mecum egeras	FALSE
78547	omnia sum diligentissime persecutus	Cic.Att.6.1.3	Omnia sum diligentissime persecutus.	Levei tudo a cabo com a maior presteza.	José Dejalma Dezotti	4794	omnia sum diligentissime persecutus	omnia sum diligentissime persecutus	TRUE
78548	primum ab Ariobarzane sic contendi ut talenta quae mihi pollicebatur illi daret	Cic.Att.6.1.3	Primum ab Ariobarzane sic contendi, ut talenta quae mihi pollicebatur illi daret.	Em primeiro lugar, pedi a Ariobárzanes que ele lhe desse os talentos que me prometia.	José Dejalma Dezotti	4795	primum ab ariobarzane sic contendi ut talenta quae mihi pollicebatur illi daret	primum ab ariobarzane sic contendi ut talenta quae mihi pollicebatur illi daret	TRUE
78549	quoad me cum rex fuit perbono loco res erat	Cic.Att.6.1.3	Quoad mecum rex fuit, perbono loco res erat;	Enquanto o rei esteve comigo, a coisa estava em excelente situação;	José Dejalma Dezotti	4796	quoad me cum rex fuit perbono loco res erat	quoad mecum rex fuit perbono loco res erat	FALSE
85870	post a Pompei procuratoribus sescentis premi coeptus est	Cic.Att.6.1.3	post a Pompei procuratoribus sescentis premi coeptus est.	depois ele começou a ser pressionado por seiscentos procuradores de Pompeu.	José Dejalma Dezotti	4797	post a pompei procuratoribus sescentis premi coeptus est	post a pompei procuratoribus sescentis premi coeptus est	TRUE
78550	Pompeius autem quom ob ceteras causas plus potest unus quam ceteri omnes tum quod putatur ad bellum Parthicum esse venturus	Cic.Att.6.1.3	Pompeius autem cum ob ceteras causas plus potest unus quam ceteri omnes, tum quod putatur ad bellum Parthicum esse uenturus.	E Pompeu sozinho tem, por diversas razões, mais poder que todos os outros, mas principalmente porque se julga que ele virá para a guerra contra os partos.	José Dejalma Dezotti	4798	pompeius autem quom ob ceteras causas plus potest unus quam ceteri omnes tum quod putatur ad bellum parthicum esse uenturus	pompeius autem cum ob ceteras causas plus potest unus quam ceteri omnes tum quod putatur ad bellum parthicum esse uenturus	FALSE
78551	ei tamen sic nunc solvitur	Cic.Att.6.1.3	Ei tamen sic nunc soluitur:	A ele, contudo, se paga assim agora:	José Dejalma Dezotti	4799	ei tamen sic nunc soluitur	ei tamen sic nunc soluitur	TRUE
85871	tricesimo quoque die talenta Attica triginta tria et hoc ex tributis	Cic.Att.6.1.3	tricesimo quoque die talenta Attica XXXIII, et hoc ex tributis;	cada trinta dias trinta e três talentos áticos, e isto sai dos impostos;	José Dejalma Dezotti	4800	tricesimo quoque die talenta attica triginta tria et hoc ex tributis	tricesimo quoque die talenta attica xxxiii et hoc ex tributis	FALSE
78553	sed Gnaeus noster clementer id fert	Cic.Att.6.1.3	Sed Gnaeus noster clementer id fert;	Mas o nosso amigo Cneu suporta isso com clemência;	José Dejalma Dezotti	4801	sed gnaeus noster clementer id fert	sed gnaeus noster clementer id fert	TRUE
85872	sorte caret	Cic.Att.6.1.3	sorte caret,	não tem capital,	José Dejalma Dezotti	4802	sorte caret	sorte caret	TRUE
78554	alii ne que solvit cuiquam ne c potest solvere	Cic.Att.6.1.3	Alii neque soluit cuiquam nec potest soluere;	Ele (o rei) não para a nenhum outro nem pode pagar;	José Dejalma Dezotti	4803	alii neque soluit cuiquam nec potest soluere	alii neque soluit cuiquam nec potest soluere	TRUE
85874	nullum enim aerarium nullum vectigal habet	Cic.Att.6.1.3	nullum enim aerarium, nullum uectigal habet.	pois não tem nenhum erário, nenhum imposto.	José Dejalma Dezotti	4804	nullum enim aerarium nullum uectigal habet	nullum enim aerarium nullum uectigal habet	TRUE
78555	Appi instituto tributa imperat	Cic.Att.6.1.3	Appi instituto tributa imperat;	exige tributos com a regulamentação de Ápio;	José Dejalma Dezotti	4805	appi instituto tributa imperat	appi instituto tributa imperat	TRUE
78556	ea vix in faenus Pompei quod satis sit efficiunt	Cic.Att.6.1.3	ea uix in faenus Pompei quod satis sit efficiunt.	esses mal são suficientes para cobrir o rendimento de Pompeu.	José Dejalma Dezotti	4806	ea uix in faenus pompei quod satis sit efficiunt	ea uix in faenus pompei quod satis sit efficiunt	TRUE
78557	amici regis duo tres ve perdivites sunt sed ii suum tam diligenter tenent quam ego aut tu	Cic.Att.6.1.3	Amici regis duo tresue perdiuites sunt, sed ii suum tam diligenter tenent quam ego aut tu.	Dois ou três amigos do rei são muito ricos, mas esses mantêm o seu com tanto empenho quanto eu ou tu.	José Dejalma Dezotti	4807	amici regis duo tres ue perdiuites sunt sed ii suum tam diligenter tenent quam ego aut tu	amici regis duo tresue perdiuites sunt sed ii suum tam diligenter tenent quam ego aut tu	FALSE
78558	equidem non desino tamen per litteras rogare suadere accusare regem	Cic.Att.6.1.3	Equidem non desino tamen per litteras rogare, suadere, accusare regem.	Na verdade, não deixo, contudo, de rogar, de persuadir, de repreender o rei, por cartas.	José Dejalma Dezotti	4808	equidem non desino tamen per litteras rogare suadere accusare regem	equidem non desino tamen per litteras rogare suadere accusare regem	TRUE
78559	Deiotarus etiam mihi narravit se ad eum legatos misisse de re Bruti	Cic.Att.6.1.4	**4** Deiotarus etiam mihi narrauit se ad eum legatos misisse de re Bruti;	**4** Dejótaro me contou também que enviou legados a ele a respeito do caso de Bruto;	José Dejalma Dezotti	4809	deiotarus etiam mihi narrauit se ad eum legatos misisse de re bruti	deiotarus etiam mihi narrauit se ad eum legatos misisse de re bruti	TRUE
85875	eos sibi responsum rettulisse illum non habere	Cic.Att.6.1.4	eos sibi responsum rettulisse illum non habere.	que eles lhe trouxeram a resposta de que ele não tinha.	José Dejalma Dezotti	4810	eos sibi responsum rettulisse illum non habere	eos sibi responsum rettulisse illum non habere	TRUE
78560	et me hercule ego ita iudico nihil illo regno spoliatius nihil rege egentius	Cic.Att.6.1.4	Et mehercule ego ita iudico, nihil illo regno spoliatius, nihil rege egentius.	E, por hércules, eu também julgo assim, não há nada mais espoliado do que aquele reino, nada mais pobre do que o rei.	José Dejalma Dezotti	4811	et me hercule ego ita iudico nihil illo regno spoliatius nihil rege egentius	et mehercule ego ita iudico nihil illo regno spoliatius nihil rege egentius	FALSE
78561	itaque aut tutela cogito me abdicare aut ut pro Glabrione Scaevola faenus et impendium recusare	Cic.Att.6.1.4	Itaque aut tutela cogito me abdicare aut, ut pro Glabrione Scaeuola, faenus et impendium recusare.	E assim eu penso ou abdicar de minha tutela ou, como Cévola em favor de Glabrião, rejeitar o lucro e o rendimento.	José Dejalma Dezotti	4812	itaque aut tutela cogito me abdicare aut ut pro glabrione scaeuola faenus et impendium recusare	itaque aut tutela cogito me abdicare aut ut pro glabrione scaeuola faenus et impendium recusare	TRUE
78562	ego tamen quas per te Bruto promiseram praefecturas Marco Scaptio Lucio Gavio qui in regno rem Bruti procurabant detuli	Cic.Att.6.1.4	Ego tamen quas per te Bruto promiseram praefecturas M. Scaptio, L. Gauio, qui in regno rem Bruti procurabant, detuli;	Eu, contudo, concedi as prefeituras que tinha prometido por tua intervenção a Bruto a Marco Escápcio e Lúcio Gávio, que se ocupavam do assunto de Bruto no reino;	José Dejalma Dezotti	4813	ego tamen quas per te bruto promiseram praefecturas marco scaptio lucio gauio qui in regno rem bruti procurabant detuli	ego tamen quas per te bruto promiseram praefecturas m scaptio l gauio qui in regno rem bruti procurabant detuli	FALSE
85876	ne c enim in provincia mea negotiabantur	Cic.Att.6.1.4	nec enim in prouincia mea negotiabantur.	pois não estavam comerciando em minha província.	José Dejalma Dezotti	4814	nec enim in prouincia mea negotiabantur	nec enim in prouincia mea negotiabantur	TRUE
78563	tu autem meministi nos sic agere ut quot vellet praefecturas sumeret dum ne negotiatori	Cic.Att.6.1.4	Tu autem meministi nos sic agere ut quot uellet praefecturas sumeret, dum ne negotiatori;	E tu te lembras de que nós atuamos de tal modo que ele tomasse quantas prefeituras quisesse, desde que não para um comerciante;	José Dejalma Dezotti	4815	tu autem meministi nos sic agere ut quot uellet praefecturas sumeret dum ne negotiatori	tu autem meministi nos sic agere ut quot uellet praefecturas sumeret dum ne negotiatori	TRUE
78564	itaque duas ei praeterea dederam	Cic.Att.6.1.4	itaque duas ei praeterea dederam,	e assim lhe dei além disso duas,	José Dejalma Dezotti	4816	itaque duas ei praeterea dederam	itaque duas ei praeterea dederam	TRUE
78565	sed ii quibus petierat de provincia decesserant	Cic.Att.6.1.4	sed ii quibus petierat de prouincia decesserant.	mas aqueles para os quais ele tinha solicitado tinham ido embora da província.	José Dejalma Dezotti	4817	sed ii quibus petierat de prouincia decesserant	sed ii quibus petierat de prouincia decesserant	TRUE
78566	nunc cognosce de Salaminiis quod video tibi etiam novum accidisse tamquam mihi	Cic.Att.6.1.5	**5** Nunc cognosce de Salaminis, quod uideo tibi etiam nouum accidisse, tamquam mihi.	**5** Agora inteira-te sobre a gente de Salamina, pois vejo que também a ti te pegou de surpresa tal qual a mim.	José Dejalma Dezotti	4818	nunc cognosce de salaminiis quod uideo tibi etiam nouum accidisse tamquam mihi	nunc cognosce de salaminis quod uideo tibi etiam nouum accidisse tamquam mihi	FALSE
78567	numquam enim ex illo audivi illam pecuniam esse suam	Cic.Att.6.1.5	Numquam enim ex illo audiui illam pecuniam esse suam;	Pois nunca ouvi dele que o dinheiro era seu;	José Dejalma Dezotti	4819	numquam enim ex illo audiui illam pecuniam esse suam	numquam enim ex illo audiui illam pecuniam esse suam	TRUE
85877	quin etiam libellum ipsius habeo in quo est Salaminii pecuniam debent Marco Scaptio et Publio Matinio familiaribus meis	Cic.Att.6.1.5	quin etiam libellum ipsius habeo in quo est “Salamini pecuniam debent M. Scaptio et P. Matinio, familiaribus meis”.	e ainda mais, tenho apontamentos dele em que está: “Os salminos devem dinheiro a Marco Escápcio e Públio Matínio, amigos meus”.	José Dejalma Dezotti	4820	quin etiam libellum ipsius habeo in quo est salaminii pecuniam debent marco scaptio et publio matinio familiaribus meis	quin etiam libellum ipsius habeo in quo est salamini pecuniam debent m scaptio et p matinio familiaribus meis	FALSE
78568	eos mihi commendat	Cic.Att.6.1.5	Eos mihi commendat;	Ele os recomenda a mim;	José Dejalma Dezotti	4821	eos mihi commendat	eos mihi commendat	TRUE
85878	adscribit etiam et quasi calcar admovet intercessisse se pro iis magnam pecuniam	Cic.Att.6.1.5	adscribit etiam et quasi calcar admouet intercessisse se pro iis magnam pecuniam.	acrescenta ainda, e, por assim dizer, me estimula, que interpôs em favor deles uma grande quantia.	José Dejalma Dezotti	4822	adscribit etiam et quasi calcar admouet intercessisse se pro iis magnam pecuniam	adscribit etiam et quasi calcar admouet intercessisse se pro iis magnam pecuniam	TRUE
78569	confeceram ut solverent centesimis bienni ductis cum renovatione singulorum annorum	Cic.Att.6.1.5	Confeceram ut soluerent centesimis †sexenni† ductis cum renouatione singulorum annorum.	Eu consegui que pagassem juros de um por cento mensal com acumulação de juros cada ano.	José Dejalma Dezotti	4823	confeceram ut soluerent centesimis bienni ductis cum renouatione singulorum annorum	confeceram ut soluerent centesimis sexenni ductis cum renouatione singulorum annorum	FALSE
78570	at Scaptius quaternas postulabat	Cic.Att.6.1.5	At Scaptius quaternas postulabat.	Mas Escápcio pedia quatro por cento.	José Dejalma Dezotti	4824	at scaptius quaternas postulabat	at scaptius quaternas postulabat	TRUE
78571	metui si impetrasset ne tu ipse me amare desineres	Cic.Att.6.1.5	Metui, si impetrasset, ne tu ipse me amare desineres;	Tive medo de que, se ele conseguisse, tu próprio deixarias de gostar de mim;	José Dejalma Dezotti	4825	metui si impetrasset ne tu ipse me amare desineres	metui si impetrasset ne tu ipse me amare desineres	TRUE
85879	nam ab edicto meo recessissem et civitatem in Catonis et in ipsius Bruti fide locatam meis que beneficiis ornatam funditus perdidissem	Cic.Att.6.1.5	nam ab edicto meo recessissem et ciuitatem in Catonis et in ipsius Bruti fide locatam meisque beneficiis ornatam funditus perdidissem.	pois eu teria me afastado de meu edito e teria arruinado completamente uma cidade colocada sob a proteção de Catão e do próprio Bruto e provida de meus favores.	José Dejalma Dezotti	4826	nam ab edicto meo recessissem et ciuitatem in catonis et in ipsius bruti fide locatam meisque beneficiis ornatam funditus perdidissem	nam ab edicto meo recessissem et ciuitatem in catonis et in ipsius bruti fide locatam meisque beneficiis ornatam funditus perdidissem	TRUE
78572	atque hoc tempore ipso impingit mihi epistulam Scaptius Bruti rem illam suo periculo esse quod ne c mihi umquam Brutus dixerat ne c tibi etiam ut praefecturam Scaptio deferrem	Cic.Att.6.1.6	**6** Atque hoc tempore ipso impingit mihi epistulam Scaptius a Bruto rem illam suo periculo esse, quod nec mihi umquam Brutus dixerat nec tibi, etiam ut praefecturam Scaptio deferrem.	**6** E neste mesmo momento Escápcio me lança uma carta de Bruto: que aquele assunto o afetava, o que Bruto nunca dissera nem a mim nem a ti, que também concedesse a prefeitura a Escápcio.	José Dejalma Dezotti	4827	atque hoc tempore ipso impingit mihi epistulam scaptius bruti rem illam suo periculo esse quod nec mihi umquam brutus dixerat nec tibi etiam ut praefecturam scaptio deferrem	atque hoc tempore ipso impingit mihi epistulam scaptius a bruto rem illam suo periculo esse quod nec mihi umquam brutus dixerat nec tibi etiam ut praefecturam scaptio deferrem	FALSE
