sentence_id	sentence	ref	latintext	translation	translator	sent_order	norm_sentence	norm_text	sameEdition
78685	num igitur iacet Theophrastus si id a Timaeo tuo familiari reprensum est	Cic.Att.6.1.18	Num igitur iacet Theophrastus si id a Timaeo, tuo familiari, reprehensum est?	Por acaso Teofrasto está então abatido por isso ter sido repreendido por Timeu, teu amigo?	José Dejalma Dezotti	4972	num igitur iacet theophrastus si id a timaeo tuo familiari reprensum est	num igitur iacet theophrastus si id a timaeo tuo familiari reprehensum est	FALSE
78686	sed nescire proavum suum censorem non fuisse turpe est praesertim cum post eum consulem nemo Cornelius illo vivo censor fuerit	Cic.Att.6.1.18	Sed nescire proauum suum censorem non fuisse turpe est, praesertim cum post eum consulem nemo Cornelius illo uiuo censor fuerit.	Mas é vergonhoso não saber que seu próprio bisavô não foi censor, sobretudo quando, após ter sido ele cônsul, não houve nenhum Cornélio censor, enquanto ele esteve vivo.	José Dejalma Dezotti	4973	sed nescire proauum suum censorem non fuisse turpe est praesertim cum post eum consulem nemo cornelius illo uiuo censor fuerit	sed nescire proauum suum censorem non fuisse turpe est praesertim cum post eum consulem nemo cornelius illo uiuo censor fuerit	TRUE
78687	quod de Philotimo et de solutione HS X̅X̅DC scribis Philotimum circiter Kal.Ianuarias in Chersonesum audio venisse	Cic.Att.6.1.19	**19** Quod de Philotimo et de solutione HS XXDC scribis, Philotimum circiter Kal. Ian. in Chersonesum audio uenisse;	**19** Quanto ao que escreves sobre Filótimo e sobre o pagamento de 20.600 sestércios, ouço que Filótimo chegou em Quersoneso por volta da calendas de janeiro \[1º. de janeiro\];	José Dejalma Dezotti	4974	quod de philotimo et de solutione hs x̅x̅dc scribis philotimum circiter kalianuarias in chersonesum audio uenisse	quod de philotimo et de solutione hs xxdc scribis philotimum circiter kal ian in chersonesum audio uenisse	FALSE
78689	at mi ab eo nihil adhuc	Cic.Att.6.1.19	At mi ab eo nihil adhuc.	Mas a mim nada da parte dele até agora.	José Dejalma Dezotti	4975	at mi ab eo nihil adhuc	at mi ab eo nihil adhuc	TRUE
78690	reliqua mea Camillus scribit se accepisse	Cic.Att.6.1.19	Reliqua mea Camillus scribit se accepisse.	Camilo escreve que recebeu o meu restante.	José Dejalma Dezotti	4976	reliqua mea camillus scribit se accepisse	reliqua mea camillus scribit se accepisse	TRUE
78691	ea quae sint nescio et aveo scire	Cic.Att.6.1.19	Ea quae sint nescio et aueo scire.	Não sei o que é e tenho vontade de saber.	José Dejalma Dezotti	4977	ea quae sint nescio et aueo scire	ea quae sint nescio et aueo scire	TRUE
78692	verum haec posterius et coram fortasse commodius	Cic.Att.6.1.19	Sed uerum haec posterius et coram fortasse commodius.	Mas, na verdade, isso talvez melhor mais tarde e pessoalmente.	José Dejalma Dezotti	4978	uerum haec posterius et coram fortasse commodius	sed uerum haec posterius et coram fortasse commodius	FALSE
78693	illud me mi Attice in extrema fere parte epistulae commovit	Cic.Att.6.1.20	**20** Illud me, mi Attice, in extrema fere parte epistulae commouit;	**20** Aquilo quase na parte final da carta, meu querido Ático, me abalou;	José Dejalma Dezotti	4979	illud me mi attice in extrema fere parte epistulae commouit	illud me mi attice in extrema fere parte epistulae commouit	TRUE
85917	scribis enim sic	Cic.Att.6.1.20	scribis enim sic,	pois escreves assim,	José Dejalma Dezotti	4980	scribis enim sic	scribis enim sic	TRUE
89040	τί λοιπόν	Cic.Att.6.1.20	“τί λοιπόν;”,	“*o que resta, então?*”,	José Dejalma Dezotti	4981	τί λοιπν	τ λοιπν;	FALSE
85918	deinde me obsecras amantissime ne obliviscar vigilare et ut animadvertam quae fiant	Cic.Att.6.1.20	deinde me obsecras amantissime ne obliuiscar uigilare et ut animaduertam quae fiant.	depois me suplicas muito carinhosamente que eu não me esqueça de estar alerta e que preste atenção ao que acontece.	José Dejalma Dezotti	4982	deinde me obsecras amantissime ne obliuiscar uigilare et ut animaduertam quae fiant	deinde me obsecras amantissime ne obliuiscar uigilare et ut animaduertam quae fiant	TRUE
78694	num quid de quo inaudisti	Cic.Att.6.1.20	Num quid de quo inaudisti?	O que é que ouviste e a respeito de quem?	José Dejalma Dezotti	4983	num quid de quo inaudisti	num quid de quo inaudisti	TRUE
78695	etsi nihil eius modi est	Cic.Att.6.1.20	Etsi nihil eius modi est;	Ainda que não haja nada desse tipo;	José Dejalma Dezotti	4984	etsi nihil eius modi est	etsi nihil eius modi est	TRUE
78696	πολλοῦ γε καὶ δεῖ	Cic.Att.6.1.20	πολλοῦ γε καὶ δεῖ.		José Dejalma Dezotti	4985	πολλο γε κα δε	πολλο γε κα δε	TRUE
78697	ne c enim me fefellisset ne c fallet	Cic.Att.6.1.20	Nec enim me fefellisset nec fallet.	Pois nem me teria escapado nem me escapará.	José Dejalma Dezotti	4986	nec enim me fefellisset nec fallet	nec enim me fefellisset nec fallet	TRUE
78698	sed ista admonitio tua tam accurata nescio quid mihi significare visa est	Cic.Att.6.1.20	Sed ista admonitio tua tam accurata nescio quid mihi significare uisa est.	Mas essa advertência tua tão cuidadosa me pareceu indicar não sei o que.	José Dejalma Dezotti	4987	sed ista admonitio tua tam accurata nescio quid mihi significare uisa est	sed ista admonitio tua tam accurata nescio quid mihi significare uisa est	TRUE
78699	de Marco Octavio iterum iam tibi rescribo te illi probe respondisse	Cic.Att.6.1.21	**21** De M. Octauio, iterum iam tibi rescribo te illi probe respondisse;	**21** A respeito de Marco Otávio, te repito novamente que tu já respondeste corretamente a ele;	José Dejalma Dezotti	4988	de marco octauio iterum iam tibi rescribo te illi probe respondisse	de m octauio iterum iam tibi rescribo te illi probe respondisse	FALSE
85919	paulo vellem fidentius	Cic.Att.6.1.21	paulo uellem fidentius.	eu queria com um pouco mais de firmeza.	José Dejalma Dezotti	4989	paulo uellem fidentius	paulo uellem fidentius	TRUE
78700	nam Caelius libertum ad me misit et litteras accurate scriptas et de pantheris et a civitatibus	Cic.Att.6.1.21	Nam Caelius libertum ad me misit et litteras accurate scriptas et de pantheris et (+) a ciuitatibus.	Pois Célio me mandou um liberto e uma carta cuidadosamente escrita sobre as panteras e (+) das cidades.	José Dejalma Dezotti	4990	nam caelius libertum ad me misit et litteras accurate scriptas et de pantheris et a ciuitatibus	nam caelius libertum ad me misit et litteras accurate scriptas et de pantheris et a ciuitatibus	TRUE
78701	rescripsi alterum me moleste ferre si ego in tenebris laterem ne c audiretur Romae nullum in mea provincia nummum nisi in aes alienum erogari docui que ne c mihi conciliare pecuniam licere ne c illi capere monui que eum quem plane diligo ut cum alios accusasset cautius viveret	Cic.Att.6.1.21	Rescripsi ad alterum me moleste ferre, si ego in tenebris laterem nec audiretur Romae nullum in mea prouincia nummum nisi in aes alienum erogari, docuique nec mihi conciliare pecuniam licere nec illi capere, monuique eum, quem plane diligo, ut cum alios accusasset cautius uiueret;	Respondi ao segundo que me sinto mal, se eu me oculto em trevas e não se ouve em Roma que não foi fornecido para as despesas em minha província nenhuma moeda a não ser para as dívidas, e mostrei que nem a mim era permitido conseguir dinheiro nem a ele recebê-lo, e adverti a ele, a quem tenho grande apreço, que, visto que tinha acusado os outros, vivesse com mais cautela;	José Dejalma Dezotti	4991	rescripsi alterum me moleste ferre si ego in tenebris laterem nec audiretur romae nullum in mea prouincia nummum nisi in aes alienum erogari docuique nec mihi conciliare pecuniam licere nec illi capere monuique eum quem plane diligo ut cum alios accusasset cautius uiueret	rescripsi ad alterum me moleste ferre si ego in tenebris laterem nec audiretur romae nullum in mea prouincia nummum nisi in aes alienum erogari docuique nec mihi conciliare pecuniam licere nec illi capere monuique eum quem plane diligo ut cum alios accusasset cautius uiueret	FALSE
85922	illud autem alterum alienum esse existimatione mea Cibyratas imperio meo publice venari	Cic.Att.6.1.21	illud autem alterum alienum esse existimatione mea, Cibyratas imperio meo publice uenari.	já o outro ponto, que era incompatível com minha reputação que os habitantes de Cíbira caçassem oficialmente por ordem minha.	José Dejalma Dezotti	4992	illud autem alterum alienum esse existimatione mea cibyratas imperio meo publice uenari	illud autem alterum alienum esse existimatione mea cibyratas imperio meo publice uenari	TRUE
78702	Lepta tua epistula gaudio exsultat	Cic.Att.6.1.22	**22** Lepta tua epistula gaudio exsultat;	**22** Lepta está pulando de alegria com tua carta;	José Dejalma Dezotti	4993	lepta tua epistula gaudio exsultat	lepta tua epistula gaudio exsultat	TRUE
85923	etenim scripta belle est me que apud eum magna in gratia posuit	Cic.Att.6.1.22	etenim scripta belle est meque apud eum magna in gratia posuit.	de fato, está magnificamente escrita e me pôs em grande disposição junto a ele.	José Dejalma Dezotti	4994	etenim scripta belle est meque apud eum magna in gratia posuit	etenim scripta belle est meque apud eum magna in gratia posuit	TRUE
78703	filiola tua gratum mihi fecit quod tibi diligenter mandavit ut mihi salutem adscriberes	Cic.Att.6.1.22	Filiola tua gratum mihi fecit quod tibi diligenter mandauit ut mihi salutem adscriberes,	Tua filhinha me fez agradecido por ter te encarregado com diligência que me saudasses,	José Dejalma Dezotti	4995	filiola tua gratum mihi fecit quod tibi diligenter mandauit ut mihi salutem adscriberes	filiola tua gratum mihi fecit quod tibi diligenter mandauit ut mihi salutem adscriberes	TRUE
85924	gratum etiam Pilia sed illa officiosius quod mihi quem iam pridem numquam vidit	Cic.Att.6.1.22	gratum etiam Pilia, sed illa officiosius quod me, quem iam pridem amat, numquam uidit;	agradecido também a Pília, mas aquela mais atenciosamente porque a mim, que já há muito me quer bem, nunca me viu;	José Dejalma Dezotti	4996	gratum etiam pilia sed illa officiosius quod mihi quem iam pridem numquam uidit	gratum etiam pilia sed illa officiosius quod me quem iam pridem amat numquam uidit	FALSE
78704	igitur tu quoque salutem utrique adscribito	Cic.Att.6.1.22	igitur tu quoque salutem utrique adscribito.	portanto, tu também saúde a ambas.	José Dejalma Dezotti	4997	igitur tu quoque salutem utrique adscribito	igitur tu quoque salutem utrique adscribito	TRUE
78705	litterarum datarum dies pr Kal Ianuar suavem habuit recordationem clarissimi iuris iurandi quod ego non eram oblitus	Cic.Att.6.1.22	Litterarum datarum dies prid. Kal. Ian. suauem habuit recordationem clarissimi iuris iurandi quod ego non eram oblitus;	O dia da entrega de tua carta, véspera das calendas de janeiro \[31 de dezembro\] teve uma doce lembrança do famosíssimo juramento que eu não esqueci;	José Dejalma Dezotti	4998	litterarum datarum dies pr kal ianuar suauem habuit recordationem clarissimi iuris iurandi quod ego non eram oblitus	litterarum datarum dies prid kal ian suauem habuit recordationem clarissimi iuris iurandi quod ego non eram oblitus	FALSE
78706	Magnus enim praetextatus illo die fui	Cic.Att.6.1.22	Magnus enim praetextatus illo die fui.	pois fui Magno aquele dia com a toga pretexta.	José Dejalma Dezotti	4999	magnus enim praetextatus illo die fui	magnus enim praetextatus illo die fui	TRUE
78707	habes ad omnia	Cic.Att.6.1.22	Habes ad omnia;	Tens tudo;	José Dejalma Dezotti	5000	habes ad omnia	habes ad omnia	TRUE
78708	non ut postulasti χρύσεα χαλκείων sed paria paribus respondimus	Cic.Att.6.1.22	non, ut postulasti, “χρύσεα χαλκείων” sed paria paribus respondimus.	não, como pediste, “ouro por bronze”, mas respondemos ponto por ponto.	José Dejalma Dezotti	5001	non ut postulasti χρσεα χαλκείων sed paria paribus respondimus	non ut postulasti χρσεα χαλκεων sed paria paribus respondimus	FALSE
78709	ecce autem alia pusilla epistula quam non relinquam ἀναντιφώνητον	Cic.Att.6.1.23	**23** Ecce autem alia pusilla epistula, quam non relinquam ἀναντιφώνητον.	**23** Eis, porém, outra pequena carta, que não deixarei *sem resposta*.	José Dejalma Dezotti	5002	ecce autem alia pusilla epistula quam non relinquam ναντιφνητον	ecce autem alia pusilla epistula quam non relinquam ναντιφνητον	TRUE
78711	et velim scire qui sit eius status	Cic.Att.6.1.23	et uelim scire qui sit eius status.	e eu queria saber qual é a situação dele.	José Dejalma Dezotti	5003	et uelim scire qui sit eius status	et uelim scire qui sit eius status	TRUE
78712	Lentulum quidem nostrum omnia praeter Tusculanum proscripsisse audio	Cic.Att.6.1.23	Lentulum quidem nostrum \*\*\* praeter Tusculanum proscripsisse audio.	Ouço, na verdade, que o nosso amigo Lêntulo pôs \[tudo\] à venda, exceto a chácara de Túsculo.	José Dejalma Dezotti	5004	lentulum quidem nostrum omnia praeter tusculanum proscripsisse audio	lentulum quidem nostrum \\\ praeter tusculanum proscripsisse audio	FALSE
78713	cupio hos expeditos videre	Cic.Att.6.1.23	Cupio hos expeditos uidere,	Desejo vê-los desembaraçados,	José Dejalma Dezotti	5005	cupio hos expeditos uidere	cupio hos expeditos uidere	TRUE
85925	cupio etiam Sestium	Cic.Att.6.1.23	cupio etiam Sestium,	desejo também a Séstio,	José Dejalma Dezotti	5006	cupio etiam sestium	cupio etiam sestium	TRUE
85928	adde si s Caelium	Cic.Att.6.1.23	adde sis Caelium;	acrescenta, se queres, Célio;	José Dejalma Dezotti	5007	adde sis caelium	adde sis caelium	TRUE
85927	in quibus omnibus est αἴδεσθεν μὲν ἀνήνασθαι, δεῖσαν δ᾽ ὑποδέχθαι.	Cic.Att.6.1.23	in quibus omnibus est “αἴδεσθεν μὲν ἀνήνασθαι, δεῖσαν δ' ὑποδέχθαι”.	em todos esses há “*vergonha em recusar, temor em aceitar*”.	José Dejalma Dezotti	5008	in quibus omnibus est αδεσθεν μν νήνασθαι δεσαν δ ποδέχθαι	in quibus omnibus est αδεσθεν μν ννασθαι δεσαν δ ποδχθαι	FALSE
85929	de Memmio restituendo ut Curio cogitet te audisse puto	Cic.Att.6.1.23	De Memmio restituendo ut Curio cogitet te audisse puto.	Sobre a restituição de Mêmio acho que ouviste como Curião pensa fazê-lo.	José Dejalma Dezotti	5009	de memmio restituendo ut curio cogitet te audisse puto	de memmio restituendo ut curio cogitet te audisse puto	TRUE
78714	de Egnati Sidicini nomine ne c nulla ne c magna spe sumus	Cic.Att.6.1.23	De Egnati Sidicini nomine nec nulla nec magna spe sumus.	Sobre a dívida de Egnácio Sidicino estamo com alguma, não grande esperança.	José Dejalma Dezotti	5010	de egnati sidicini nomine nec nulla nec magna spe sumus	de egnati sidicini nomine nec nulla nec magna spe sumus	TRUE
78715	Pinarium quem mihi commendas diligentissime Deiotarus curat graviter aegrum	Cic.Att.6.1.23	Pinarium, quem mihi commendas, diligentissime Deiotarus curat grauiter aegrum.	A Pinário, que me recomendas, gravemente doente, Dejótaro cuida dele com o maior empenho.	José Dejalma Dezotti	5011	pinarium quem mihi commendas diligentissime deiotarus curat grauiter aegrum	pinarium quem mihi commendas diligentissime deiotarus curat grauiter aegrum	TRUE
78716	respondi etiam minori	Cic.Att.6.1.23	Respondi etiam minori.	Respondi também a mais curta.	José Dejalma Dezotti	5012	respondi etiam minori	respondi etiam minori	TRUE
78717	tu velim dum ero Laodiceae id est ad Idus Maias quam saepissime me cum per litteras colloquare et cum Athenas veneris iam enim sciemus de rebus urbanis de provinciis quae omnia in mensem Martium sunt conlata utique ad me tabellarios mittas	Cic.Att.6.1.24	**24** Tu uelim dum ero Laodiceae, id est ad Id. Mai., quam saepissime mecum per litteras colloquare et cum Athenas ueneris (iam enim sciemus de rebus urbanis, de prouinciis, quae omnia in mensem Martium sunt collata) utique ad me tabellarios mittas.	**24** Queria que tu, enquanto eu estiver em Laodicéia, isto é, até os idos de maio \[15 de maio\] falasse comigo por cartas o mais frequentemente possível e, quando vieres a Atenas (pois já saberemos sobre os assuntos urbanos, sobre as províncias, tudo que foi aprazado para o mês de março), me envies sobretudo carteiros.	José Dejalma Dezotti	5013	tu uelim dum ero laodiceae id est ad idus maias quam saepissime me cum per litteras colloquare et cum athenas ueneris iam enim sciemus de rebus urbanis de prouinciis quae omnia in mensem martium sunt conlata utique ad me tabellarios mittas	tu uelim dum ero laodiceae id est ad id mai quam saepissime mecum per litteras colloquare et cum athenas ueneris iam enim sciemus de rebus urbanis de prouinciis quae omnia in mensem martium sunt collata utique ad me tabellarios mittas	FALSE
78720	in quo ut audio magnum odium Pompei suscepistis	Cic.Att.6.1.25	In quo, ut audio, magnum odium Pompei suscepistis;	Com isso, conforme ouço, atraístes um grande ódio de Pompeu;	José Dejalma Dezotti	5014	in quo ut audio magnum odium pompei suscepistis	in quo ut audio magnum odium pompei suscepistis	TRUE
78721	putat enim suos nummos vos comedisse Caesarem in Nemore aedificando diligentiorem fore	Cic.Att.6.1.25	putat enim suos nummos uos comedisse, Caesarem in Nemore aedificando diligentiorem fore.	pois ele acha que vós comestes o seu próprio dinheiro, que César será mais diligente em edificar no Bosque.	José Dejalma Dezotti	5015	putat enim suos nummos uos comedisse caesarem in nemore aedificando diligentiorem fore	putat enim suos nummos uos comedisse caesarem in nemore aedificando diligentiorem fore	TRUE
78722	haec ego ex Publio Vedio magno nebulone sed Pompei tamen familiari audivi	Cic.Att.6.1.25	Haec ego ex P. Vedio, magno nebulone sed Pompei tamen familiari, audiui.	Essas coisas eu ouvi de Públio Védio, um grande patife, mas amigo íntimo de Pompeu.	José Dejalma Dezotti	5016	haec ego ex publio uedio magno nebulone sed pompei tamen familiari audiui	haec ego ex p uedio magno nebulone sed pompei tamen familiari audiui	FALSE
78723	hic Vedius mihi obviam venit cum duobus essedis et raeda equis iuncta et lectica et familia magna pro qua si Curio legem pertulerit HS centenos pendat necesse est	Cic.Att.6.1.25	Hic Vedius mihi obuiam uenit cum duobus essedis et raeda equis iuncta et lectica et familia magna, pro qua, si Curio legem pertulerit, HS centenos pendat necesse est;	Este Védio veio ao meu encontro com duas carruagens e um carro com cavalos atrelados e uma liteira e uma grande séquito de escravos, pelo qual, se Curião fizer aprovar sua lei, é necessário que pague cem sestércios por cada um;	José Dejalma Dezotti	5017	hic uedius mihi obuiam uenit cum duobus essedis et raeda equis iuncta et lectica et familia magna pro qua si curio legem pertulerit hs centenos pendat necesse est	hic uedius mihi obuiam uenit cum duobus essedis et raeda equis iuncta et lectica et familia magna pro qua si curio legem pertulerit hs centenos pendat necesse est	TRUE
78724	erat praeterea cynocephalus in essedo ne c deerant onagri	Cic.Att.6.1.25	erat praeterea cynocephalus in essedo nec deerant onagri.	havia, além disso, um macaco na carruagem e não faltavam burros selvagens.	José Dejalma Dezotti	5018	erat praeterea cynocephalus in essedo nec deerant onagri	erat praeterea cynocephalus in essedo nec deerant onagri	TRUE
78725	numquam vidi hominem nequiorem	Cic.Att.6.1.25	Numquam uidi hominem nequiorem.	Nunca vi um homem mais sem valor.	José Dejalma Dezotti	5019	numquam uidi hominem nequiorem	numquam uidi hominem nequiorem	TRUE
78726	sed extremum audi	Cic.Att.6.1.25	Sed extremum audi.	Mas escuta o final.	José Dejalma Dezotti	5020	sed extremum audi	sed extremum audi	TRUE
78727	deversatus est Laodiceae apud Pompeium Vindullum	Cic.Att.6.1.25	Deuersatus est Laodiceae apud Pompeium Vindillum;	Em Laodicéia, ele se hospedou na casa de Pompeu Vindilo;	José Dejalma Dezotti	5021	deuersatus est laodiceae apud pompeium uindullum	deuersatus est laodiceae apud pompeium uindillum	FALSE
78728	ibi sua deposuit cum ad me profectus est	Cic.Att.6.1.25	ibi sua deposuit cum ad me profectus est.	ali deixou suas coisas quando veio até mim.	José Dejalma Dezotti	5022	ibi sua deposuit cum ad me profectus est	ibi sua deposuit cum ad me profectus est	TRUE
78729	moritur interim Vindullus	Cic.Att.6.1.25	Moritur interim Vindillus.	Nesse ínterim, morre Vindilo.	José Dejalma Dezotti	5023	moritur interim uindullus	moritur interim uindillus	FALSE
85931	quae res ad Magnum Pompeium pertinere putabatur	Cic.Att.6.1.25	Quod res ad Magnum Pompeium pertinere putabatur,	Como se pensava que coisas dele pertenciam a Pompeu Magno,	José Dejalma Dezotti	5024	quae res ad magnum pompeium pertinere putabatur	quod res ad magnum pompeium pertinere putabatur	FALSE
78730	Gaius Vennonius domum Vindulli venit	Cic.Att.6.1.25	C. Vennonius domum Vindilli uenit.	Caio Venônio veio à casa de Vindilo.	José Dejalma Dezotti	5025	gaius uennonius domum uindulli uenit	c uennonius domum uindilli uenit	FALSE
78731	cum omnia obsignaret in Vedianas res incidit	Cic.Att.6.1.25	Cum omnia obsignaret, in Vedianas res incidit.	Quando punha o selo em tudo, deu com as coisas de Védio.	José Dejalma Dezotti	5026	cum omnia obsignaret in uedianas res incidit	cum omnia obsignaret in uedianas res incidit	TRUE
78732	in his inventae sunt quinque imagunculae matronarum in quibus una sororis amici tui hominis bruti qui hoc utatur et illius lepidi qui haec tam neglegenter ferat	Cic.Att.6.1.25	In his inuentae sunt quinque imagunculae matronarum, in quibus una sororis amici tui, hominis bruti qui hoc utatur, et uxoris illius lepidi qui haec tam neglegenter ferat.	Nestas, foram encontradas cinco pequenos bustos de matronas, nos quais um da irmã de teu amigo, um homem bruto, que se vale deste nome, e o da esposa daquele lépido que leva isso tão negligentemente.	José Dejalma Dezotti	5027	in his inuentae sunt quinque imagunculae matronarum in quibus una sororis amici tui hominis bruti qui hoc utatur et illius lepidi qui haec tam neglegenter ferat	in his inuentae sunt quinque imagunculae matronarum in quibus una sororis amici tui hominis bruti qui hoc utatur et uxoris illius lepidi qui haec tam neglegenter ferat	FALSE
78733	haec te volui παριστορῆσαι	Cic.Att.6.1.25	Haec te uolui παριστορῆσαι;	Quis te *contar* isso;	José Dejalma Dezotti	5028	haec te uolui παριστορσαι	haec te uolui παριστορσαι	TRUE
78734	sumus enim ambo belle curiosi	Cic.Att.6.1.25	sumus enim ambo belle curiosi.	pois somos ambos lindamente curiosos.	José Dejalma Dezotti	5029	sumus enim ambo belle curiosi	sumus enim ambo belle curiosi	TRUE
78735	unum etiam velim cogites	Cic.Att.6.1.26	**26** Vnum etiam uelim cogites.	**26** Eu queria ainda que meditasses uma coisa.	José Dejalma Dezotti	5030	unum etiam uelim cogites	unum etiam uelim cogites	TRUE
78736	audio Appium πρόπυλον Eleusine facere	Cic.Att.6.1.26	Audio Appium πρόπυλον Eleusine facere;	Ouço que Ápio está fazendo um *pórtico* em Elêusis;	José Dejalma Dezotti	5031	audio appium πρπυλον eleusine facere	audio appium πρπυλον eleusine facere	TRUE
78737	num inepti fuerimus si nos quoque Academiae fecerimus	Cic.Att.6.1.26	num inepti fuerimus si nos quoque Academiae fecerimus?	acaso seremos idiotas, se nós fizermos um na Academia?	José Dejalma Dezotti	5032	num inepti fuerimus si nos quoque academiae fecerimus	num inepti fuerimus si nos quoque academiae fecerimus	TRUE
78738	puto	Cic.Att.6.1.26	“Puto”	“Acho”	José Dejalma Dezotti	5033	puto	puto	TRUE
85933	inquies	Cic.Att.6.1.26	inquies.	dirás.	José Dejalma Dezotti	5034	inquies	inquies	TRUE
78739	ergo id ipsum scribes ad me	Cic.Att.6.1.26	Ergo id ipsum scribes ad me.	Então escreves isso mesmo a mim.	José Dejalma Dezotti	5035	ergo id ipsum scribes ad me	ergo id ipsum scribes ad me	TRUE
78740	equidem valde ipsas Athenas amo	Cic.Att.6.1.26	Equidem ualde ipsas Athenas amo;	Na verdade, eu amo demais a própria Atenas;	José Dejalma Dezotti	5036	equidem ualde ipsas athenas amo	equidem ualde ipsas athenas amo	TRUE
78741	volo esse aliquod monumentum	Cic.Att.6.1.26	uolo esse aliquod monumentum,	quero ser algum monumento,	José Dejalma Dezotti	5037	uolo esse aliquod monumentum	uolo esse aliquod monumentum	TRUE
85934	odi falsas inscriptiones statuarum alienarum	Cic.Att.6.1.26	odi falsas inscriptiones statuarum alienarum.	odeio as falsas inscrições das estátuas alheias.	José Dejalma Dezotti	5038	odi falsas inscriptiones statuarum alienarum	odi falsas inscriptiones statuarum alienarum	TRUE
78742	sed ut tibi placebit facies que me in quem diem Romana incidant mysteria certiorem et quo modo hiemaris	Cic.Att.6.1.26	Sed ut tibi placebit, faciesque me in quem diem Romana incidant mysteria certiorem et quo modo hiemaris.	Mas, se te agradar, me informarás em que dia caem os mistérios romanos e como estás passando o inverno.	José Dejalma Dezotti	5039	sed ut tibi placebit faciesque me in quem diem romana incidant mysteria certiorem et quo modo hiemaris	sed ut tibi placebit faciesque me in quem diem romana incidant mysteria certiorem et quo modo hiemaris	TRUE
78743	cura ut valeas	Cic.Att.6.1.26	Cura ut ualeas.	Cuida para que estejas bem de saúde.	José Dejalma Dezotti	5040	cura ut ualeas	cura ut ualeas	TRUE
78744	post Leuctricam pugnam die septingentesimo sexagesimo quinto	Cic.Att.6.1.26	Post Leuctricam pugnam die septingentesimo sexagesimo quinto.	No septingentésimo sexagésimo quinto dia após a batalha de Leuctra.	José Dejalma Dezotti	5041	post leuctricam pugnam die septingentesimo sexagesimo quinto	post leuctricam pugnam die septingentesimo sexagesimo quinto	TRUE
