sentence_id	sentence	text_JDD	translation_JDD
13173	miserere nostri Fili David		
13174	cum autem venisset domum accesserunt ad eum caeci		
13175	et dicit eis Iesus		
13176	creditis quia possum hoc facere vobis		
13177	dicunt ei		
13178	utique Domine		
13179	tunc tetigit oculos eorum dicens		
13180	secundum fidem vestram fiat vobis		
13181	et aperti sunt oculi illorum		
13182	et comminatus est illis Iesus dicens		
13183	videte ne quis sciat		
13184	illi autem exeuntes diffamaverunt eum in tota terra illa		
13185	egressis autem illis ecce obtulerunt ei hominem mutum daemonium habentem		
13186	et eiecto daemone locutus est mutus et miratae sunt turbae dicentes		
13187	numquam paruit sic in Israhel		
13188	Pharisaei autem dicebant		
13189	in principe daemoniorum eicit daemones		
13190	et circumibat Iesus civitates omnes et castella docens in synagogis eorum et praedicans evangelium regni et curans omnem languorem et omnem infirmitatem		
13191	videns autem turbas misertus est eis quia erant vexati et iacentes sicut oves non habentes pastorem		
13193	tunc dicit discipulis suis		
47507	messis quidem multa		
47508	operarii autem pauci		
13195	rogate ergo dominum messis ut eiciat operarios in messem suam		
13196	et convocatis duodecim discipulis suis dedit illis potestatem spirituum inmundorum ut eicerent eos et curarent omnem languorem et omnem infirmitatem		
13197	duodecim autem apostolorum nomina sunt haec		
13198	primus Simon qui dicitur Petrus et Andreas frater eius Iacobus Zebedaei et Iohannes frater eius Philippus et Bartholomeus Thomas et Mattheus publicanus et Iacobus Alphei et Thaddeus Simon Cananeus et Iudas Scariotes qui et tradidit eum		
13200	hos duodecim misit Iesus praecipiens eis et dicens		
13201	in viam gentium ne abieritis et in civitates Samaritanorum ne intraveritis		
13202	sed potius ite ad oves quae perierunt domus Israhel		
13203	euntes autem praedicate dicentes quia		
13204	adpropinquavit regnum caelorum		
47509	infirmos curate		
47510	mortuos suscitate		
47511	leprosos mundate		
47512	daemones eicite		
47513	gratis accepistis		
47514	gratis date		
13207	nolite possidere aurum ne que argentum ne que pecuniam in zonis vestris non peram in via ne que duas tunicas ne que calciamenta ne que virgam		
13209	dignus enim est operarius cibo suo		
13210	in quamcumque civitatem aut castellum intraveritis interrogate quis in ea dignus sit		
13211	et ibi manete donec exeatis		
13212	intrantes autem in domum salutate eam		
13213	et siquidem fuerit domus digna veniat pax vestra super eam		
13214	si autem non fuerit digna pax vestra ad vos revertatur		
13215	et quicumque non receperit vos ne que audierit sermones vestros exeuntes foras de domo vel de civitate excutite pulverem de pedibus vestris		
13217	amen dico vobis		
13218	tolerabilius erit terrae Sodomorum et Gomorraeorum in die iudicii quam illi civitati		
13219	ecce ego mitto vos sicut oves in medio luporum		
13220	estote ergo prudentes sicut serpentes et simplices sicut columbae		
13221	cavete autem ab hominibus		
13222	tradent enim vos in conciliis et in synagogis suis flagellabunt vos		
13223	et ad praesides et ad reges ducemini propter me in testimonium illis et gentibus		
13224	cum autem tradent vos nolite cogitare quomodo aut quid loquamini		
13225	dabitur enim vobis in illa hora quid loquamini		
13226	non enim vos estis qui loquimini sed Spiritus Patris vestri qui loquitur in vobis		
13227	tradet autem frater fratrem in mortem et pater filium		
13228	et insurgent filii in parentes et morte eos adficient		
13229	et eritis odio omnibus propter nomen meum		
13230	qui autem perseveraverit in finem hic salvus erit		
13231	cum autem persequentur vos in civitate ista fugite in aliam		
47515	amen enim dico vobis		
47516	non consummabitis civitates Israhel donec veniat Filius hominis		
13233	non est discipulus super magistrum ne c servus super dominum suum		
13234	sufficit discipulo ut sit sicut magister eius et servus sicut dominus eius		
13235	si patrem familias Beelzebub vocaverunt quanto magis domesticos eius		
13236	ne ergo timueritis eos		
13237	nihil enim opertum quod non revelabitur et occultum quod non scietur		
13239	quod dico vobis in tenebris dicite in lumine		
13240	et quod in aure auditis praedicate super tecta		
13241	et nolite timere eos qui occidunt corpus animam autem non possunt occidere		
13242	sed potius eum timete qui potest et animam et corpus perdere in gehennam		
13243	nonne duo passeres asse veneunt		
13244	et unus ex illis non cadet super terram sine Patre vestro		
13245	vestri autem et capilli capitis omnes numerati sunt		
13246	nolite ergo timere		
13247	multis passeribus meliores estis vos		
13248	omnis ergo qui confitebitur me coram hominibus confitebor et ego eum coram Patre meo qui est in caelis		
13249	qui autem negaverit me coram hominibus negabo et ego eum coram Patre meo qui est in caelis		
13250	nolite arbitrari quia venerim mittere pacem in terram		
13251	non veni pacem mittere sed gladium		
13252	veni enim separare hominem adversus patrem suum et filiam adversus matrem suam et nurum adversus socrum suam		
13253	et inimici hominis domestici eius		
13254	qui amat patrem aut matrem plus quam me non est me dignus		
13255	et qui amat filium aut filiam super me non est me dignus		
13256	et qui non accipit crucem suam et sequitur me non est me dignus		
13257	qui invenit animam suam perdet illam		
13258	et qui perdiderit animam suam propter me inveniet eam		
13259	qui recipit vos me recipit		
13260	et qui me recipit recipit eum qui me misit		
13261	qui recipit prophetam in nomine prophetae mercedem prophetae accipiet		
13262	et qui recipit iustum in nomine iusti mercedem iusti accipiet		
13263	et quicumque potum dederit uni ex minimis istis calicem aquae frigidae tantum in nomine discipuli amen dico vobis non perdet mercedem suam		
47517	et factum est cum consummasset Iesus praecipiens duodecim discipulis suis		
47518	transiit inde ut doceret et praedicaret in civitatibus eorum		
13266	Iohannes autem cum audisset in vinculis opera Christi mittens duos de discipulis suis ait illi		
13267	tu es qui venturus es an alium expectamus		
13268	et respondens Iesus ait illis		
13269	euntes renuntiate Iohanni quae auditis et videtis		
47519	caeci vident		
47520	claudi ambulant		
47521	leprosi mundantur		
47522	surdi audiunt		
47523	mortui resurgunt		
47524	pauperes evangelizantur		
13271	et beatus est qui non fuerit scandalizatus in me		
13272	illis autem abeuntibus coepit Iesus dicere ad turbas de Iohanne		
47525	quid existis in desertum videre		
47526	harundinem vento agitatam		
13275	sed quid existis videre		
13276	hominem mollibus vestitum		
13277	ecce qui mollibus vestiuntur in domibus regum sunt		
13278	sed quid existis videre		
13279	prophetam		
13280	etiam dico vobis et plus quam prophetam		
13281	hic enim est de quo scriptum est		
13282	ecce ego mitto angelum meum ante faciem tuam qui praeparabit viam tuam ante te		
13284	qui autem minor est in regno caelorum maior est illo		
47527	amen dico vobis		
47528	non surrexit inter natos mulierum maior Iohanne Baptista		
13285	a diebus autem Iohannis Baptistae usque nunc regnum caelorum vim patitur et violenti rapiunt illud		
13286	omnes enim prophetae et lex usque ad Iohannem prophetaverunt		
13287	et si vultis recipere ipse est Helias qui venturus est		
13288	qui habet aures audiendi audiat		
13289	cui autem similem aestimabo generationem istam		
13290	similis est pueris sedentibus in foro		
13291	qui clamantes coaequalibus dicunt		
13292	cecinimus vobis et non saltastis		
13293	lamentavimus et non planxistis		
13294	venit enim Iohannes ne que manducans ne que bibens et dicunt		
13295	daemonium habet		
13296	venit Filius hominis manducans et bibens et dicunt		
13297	ecce homo vorax et potator vini publicanorum et peccatorum amicus		
13298	et iustificata est sapientia a filiis suis		
13299	tunc coepit exprobrare civitatibus in quibus factae sunt plurimae virtutes eius quia non egissent paenitentiam		
13300	vae tibi Corazain vae tibi Bethsaida		
13301	quia si in Tyro et Sidone factae essent virtutes quae factae sunt in vobis olim in cilicio et cinere paenitentiam egissent		
13302	verumtamen dico vobis		
13303	Tyro et Sidoni remissius erit in die iudicii quam vobis		
13304	et tu Capharnaum numquid usque in caelum exaltaberis		
13305	usque in infernum descendes quia si in Sodomis factae fuissent virtutes quae factae sunt in te forte mansissent usque in hunc diem		
13306	verumtamen dico vobis quia terrae Sodomorum remissius erit in die iudicii quam tibi		
13307	in illo tempore respondens Iesus dixit		
13308	confiteor tibi Pater Domine caeli et terrae quia abscondisti haec a sapientibus et prudentibus et revelasti ea parvulis		
13309	ita Pater quoniam sic fuit placitum ante te		
13311	omnia mihi tradita sunt a Patre meo		
13312	et nemo novit Filium nisi Pater		
13313	ne que Patrem quis novit nisi Filius et cui voluerit Filius revelare		
13314	venite ad me omnes qui laboratis et onerati estis et ego reficiam vos		
13315	tollite iugum meum super vos et discite a me quia mitis sum et humilis corde		
13316	et invenietis requiem animabus vestris		
13317	iugum enim meum suave est et onus meum leve est		
13318	in illo tempore abiit Iesus sabbato per sata		
13319	discipuli autem eius esurientes coeperunt vellere spicas et manducare		
13320	Pharisaei autem videntes dixerunt ei		
13321	ecce discipuli tui faciunt quod non licet eis facere sabbatis		
13322	at ille dixit eis		
13323	non legistis quid fecerit David quando esuriit et qui cum eo erant		
13324	quomodo intravit in domum Dei et panes propositionis comedit quos non licebat ei edere ne que his qui cum eo erant nisi solis sacerdotibus		
13325	aut non legistis in lege quia sabbatis sacerdotes in templo sabbatum violant et sine crimine sunt		
13326	dico autem vobis quia templo maior est hic		
13327	si autem sciretis quid est misericordiam volo et non sacrificium numquam condemnassetis innocentes		
13330	dominus est enim Filius hominis etiam sabbati		
13331	et cum inde transisset venit in synagogam eorum		
13332	et ecce homo manum habens aridam		
62949	et interrogabant eum dicentes si licet sabbatis curare ut accusarent eum		
13335	ipse autem dixit illis		
13336	quis erit ex vobis homo qui habeat ovem unam et si ceciderit haec sabbatis in foveam nonne tenebit et levabit eam		
13337	quanto magis melior est homo ove		
13338	itaque licet sabbatis benefacere		
13339	tunc ait homini		
13340	extende manum tuam		
13341	et extendit et restituta est sanitati sicut altera		
13342	exeuntes autem Pharisaei consilium faciebant adversus eum quomodo eum perderent		
13343	Iesus autem sciens recessit inde		
13344	et secuti sunt eum multi et curavit eos omnes		
13345	et praecepit eis ne manifestum eum facerent		
13346	ut adimpleretur quod dictum est per Esaiam prophetam dicentem		
13347	ecce puer meus quem elegi dilectus meus in quo bene placuit animae meae		
13348	ponam spiritum meum super eum et iudicium gentibus nuntiabit		
13349	non contendet ne que clamabit ne que audiet aliquis in plateis vocem eius		
13350	harundinem quassatam non confringet et linum fumigans non extinguet donec eiciat ad victoriam iudicium		
13351	et in nomine eius gentes sperabunt		
13352	tunc oblatus est ei daemonium habens caecus et mutus et curavit eum ita ut loqueretur et videret		
13353	et stupebant omnes turbae et dicebant		
13354	numquid hic est Filius David		
13355	Pharisaei autem audientes dixerunt		
13356	hic non eicit daemones nisi in Beelzebub principe daemoniorum		
13357	Iesus autem sciens cogitationes eorum dixit eis		
13358	omne regnum divisum contra se desolatur		
13359	et omnis civitas vel domus divisa contra se non stabit		
13360	et si Satanas Satanan eicit adversus se divisus est		
13361	quomodo ergo stabit regnum eius		
13362	et si ego in Beelzebub eicio daemones filii vestri in quo eiciunt		
13363	ideo ipsi iudices erunt vestri		
13364	si autem ego in Spiritu Dei eicio daemones igitur pervenit in vos regnum Dei		
13365	aut quomodo potest quisquam intrare in domum fortis et vasa eius diripere nisi prius alligaverit fortem		
13366	et tunc domum illius diripiat		
13367	qui non est me cum contra me est et qui non congregat me cum spargit		
13368	ideo dico vobis		
47529	omne peccatum et blasphemia remittetur hominibus		
47530	Spiritus autem blasphemia non remittetur		
13370	et quicumque dixerit verbum contra Filium hominis remittetur ei		
13371	qui autem dixerit contra Spiritum Sanctum non remittetur ei ne que in hoc saeculo ne que in futuro		
13372	aut facite arborem bonam et fructum eius bonum aut facite arborem malam et fructum eius malum siquidem ex fructu arbor agnoscitur		
13375	progenies viperarum quomodo potestis bona loqui cum sitis mali		
13376	ex abundantia enim cordis os loquitur		
13377	bonus homo de bono thesauro profert bona		
13378	et malus homo de malo thesauro profert mala		
13379	dico autem vobis quoniam omne verbum otiosum quod locuti fuerint homines reddent rationem de eo in die iudicii		
13380	ex verbis enim tuis iustificaberis et ex verbis tuis condemnaberis		
13381	tunc responderunt ei quidam de scribis et Pharisaeis dicentes		
13382	magister volumus a te signum videre		
13383	qui respondens ait illis		
13384	generatio mala et adultera signum quaerit		
13385	et signum non dabitur ei nisi signum Ionae prophetae		
13386	sicut enim fuit Ionas in ventre ceti tribus diebus et tribus noctibus sic erit Filius hominis in corde terrae tribus diebus et tribus noctibus		
13387	viri ninevitae surgent in iudicio cum generatione ista et condemnabunt eam quia paenitentiam egerunt in praedicatione Ionae		
62951	et ecce plus quam Iona hic		
13389	regina austri surget in iudicio cum generatione ista et condemnabit eam quia venit a finibus terrae audire sapientiam Salomonis		
62953	et ecce plus quam Salomon hic		
13391	cum autem inmundus spiritus exierit ab homine ambulat per loca arida quaerens requiem et non invenit		
13392	tunc dicit		
13393	revertar in domum meam unde exivi		
13394	et veniens invenit vacantem scopis mundatam et ornatam		
13395	tunc vadit et adsumit septem alios spiritus se cum nequiores se et intrantes habitant ibi		
13396	et fiunt novissima hominis illius peiora prioribus		
13397	sic erit et generationi huic pessimae		
13398	adhuc eo loquente ad turbas ecce mater eius et fratres stabant foris quaerentes loqui ei		
13399	dixit autem ei quidam		
13400	ecce mater tua et fratres tui foris stant quaerentes te		
13401	at ipse respondens dicenti sibi ait		
13402	quae est mater mea et qui sunt fratres mei		
13403	et extendens manum in discipulos suos dixit		
13404	ecce mater mea et fratres mei		
13405	quicumque enim fecerit voluntatem Patris mei qui in caelis est ipse meus et frater et soror et mater est		
13406	in illo die exiens Iesus de domo sedebat secus mare		
13407	et congregatae sunt ad eum turbae multae ita ut in naviculam ascendens sederet		
13408	et omnis turba stabat in litore		
13409	ecce exiit qui seminat seminare		
62954	et locutus est eis multa in parabolis dicens		
13410	et dum seminat quaedam ceciderunt secus viam et venerunt volucres et comederunt ea		
13411	alia autem ceciderunt in petrosa ubi non habebat terram multam		
13412	et continuo exorta sunt quia non habebant altitudinem terrae		
13413	sole autem orto aestuaverunt et quia non habebant radicem aruerunt		
13414	alia autem ceciderunt in spinas		
13415	et creverunt spinae et suffocaverunt ea		
13416	alia vero ceciderunt in terram bonam et dabant fructum aliud centesimum aliud sexagesimum aliud tricesimum		
13418	qui habet aures audiendi audiat		
13419	et accedentes discipuli dixerunt ei		
13420	quare in parabolis loqueris eis		
13421	qui respondens ait illis		
13422	quia vobis datum est nosse mysteria regni caelorum		
13423	illis autem non est datum		
13424	qui enim habet dabitur ei et abundabit		
13425	qui autem non habet et quod habet auferetur ab eo		
13426	ideo in parabolis loquor eis quia videntes non vident et audientes non audiunt ne que intellegunt		
13428	et adimpletur eis prophetia Esaiae dicens		
13429	auditu audietis et non intellegetis		
13430	et videntes videbitis et non videbitis		
13431	incrassatum est enim cor populi huius et auribus graviter audierunt et oculos suos cluserunt nequando oculis videant et auribus audiant et corde intellegant et convertantur et sanem eos		
13433	vestri autem beati oculi quia vident et aures vestrae quia audiunt		
13434	amen quippe dico vobis quia multi prophetae et iusti cupierunt videre quae videtis et non viderunt et audire quae auditis et non audierunt		
13436	vos ergo audite parabolam seminantis		
13437	omnis qui audit verbum regni et non intellegit venit malus et rapit quod seminatum est in corde eius		
13438	hic est qui secus viam seminatus est		
13439	qui autem supra petrosa seminatus est hic est qui verbum audit et continuo cum gaudio accipit illud		
13440	non habet autem in se radicem sed est temporalis		
13441	facta autem tribulatione et persecutione propter verbum continuo scandalizatur		
13442	qui autem est seminatus in spinis hic est qui verbum audit et sollicitudo saeculi istius et fallacia divitiarum suffocat verbum et sine fructu efficitur		
13443	qui vero in terra bona seminatus est hic est qui audit verbum et intellegit et fructum adfert et facit aliud quidem centum aliud autem sexaginta porro aliud triginta		
13444	aliam parabolam proposuit illis dicens		
13445	simile factum est regnum caelorum homini qui seminavit bonum semen in agro suo		
13446	cum autem dormirent homines venit inimicus eius et superseminavit zizania in medio tritici et abiit		
13447	cum autem crevisset herba et fructum fecisset tunc apparuerunt et zizania		
13448	accedentes autem servi patris familias dixerunt ei		
13449	domine nonne bonum semen seminasti in agro tuo		
13450	unde ergo habet zizania		
13451	et ait illis		
13452	inimicus homo hoc fecit		
13453	servi autem dixerunt ei		
13454	vis imus et colligimus ea		
13455	et ait		
13456	non ne forte colligentes zizania eradicetis simul cum eis et triticum		
13458	sinite utraque crescere usque ad messem et in tempore messis dicam messoribus		
13459	colligite primum zizania et alligate ea fasciculos ad conburendum		
13460	triticum autem congregate in horreum meum		
13461	aliam parabolam proposuit eis dicens		
13462	simile est regnum caelorum grano sinapis quod accipiens homo seminavit in agro suo		
13463	quod minimum quidem est omnibus seminibus		
13464	cum autem creverit maius est omnibus holeribus et fit arbor ita ut volucres caeli veniant et habitent in ramis eius		
13465	aliam parabolam locutus est eis		
13466	simile est regnum caelorum fermento quod acceptum mulier abscondit in farinae satis tribus donec fermentatum est totum		
13467	haec omnia locutus est Iesus in parabolis ad turbas et sine parabolis non loquebatur eis ut impleretur quod dictum erat per prophetam dicentem		
47531	aperiam in parabolis os meum		
47532	eructabo abscondita a constitutione mundi		
13471	tunc dimissis turbis venit in domum		
13472	et accesserunt ad eum discipuli eius dicentes		
62955	dissere nobis parabolam zizaniorum agri		
13474	qui respondens ait		
13475	qui seminat bonum semen est Filius hominis		
13476	ager autem est mundus		
13477	bonum vero semen hii sunt filii regni		
13478	zizania autem filii sunt nequam		
13479	inimicus autem qui seminavit ea est diabolus		
13480	messis vero consummatio saeculi est		
13481	messores autem angeli sunt		
13482	sicut ergo colliguntur zizania et igni conburuntur sic erit in consummatione saeculi		
13484	mittet Filius hominis angelos suos et colligent de regno eius omnia scandala et eos qui faciunt iniquitatem		
13485	et mittent eos in caminum ignis		
13486	ibi erit fletus et stridor dentium		
13487	tunc iusti fulgebunt sicut sol in regno Patris eorum		
13488	qui habet aures audiat		
13489	simile est regnum caelorum thesauro abscondito in agro quem qui invenit homo abscondit		
62956	et prae gaudio illius vadit et vendit universa quae habet et emit agrum illum		
13491	iterum simile est regnum caelorum homini negotiatori quaerenti bonas margaritas		
13492	inventa autem una pretiosa margarita abiit et vendidit omnia quae habuit et emit eam		
13493	iterum simile est regnum caelorum sagenae missae in mare et ex omni genere congreganti		
47533	quam cum impleta esset educentes et secus litus sedentes elegerunt bonos in vasa		
47534	malos autem foras miserunt		
13495	sic erit in consummatione saeculi		
13496	exibunt angeli et separabunt malos de medio iustorum et mittent eos in caminum ignis		
13497	ibi erit fletus et stridor dentium		
13498	intellexistis haec omnia		
13499	dicunt ei		
13500	etiam		
13501	ait illis		
13502	ideo omnis scriba doctus in regno caelorum similis est homini patri familias qui profert de thesauro suo nova et vetera		
13503	et factum est cum consummasset Iesus parabolas istas transiit inde		
13504	et veniens in patriam suam docebat eos in synagogis eorum ita ut mirarentur et dicerent		
13505	unde huic sapientia haec et virtutes		
13506	nonne hic est fabri filius		
13507	nonne mater eius dicitur Maria et fratres eius Iacobus et Ioseph et Simon et Iudas		
13508	et sorores eius nonne omnes apud nos sunt		
13509	unde ergo huic omnia ista		
13510	et scandalizabantur in eo		
13511	Iesus autem dixit eis		
13512	non est propheta sine honore nisi in patria sua et in domo sua		
13513	et non fecit ibi virtutes multas propter incredulitatem illorum		
13514	in illo tempore audiit Herodes tetrarcha famam Iesu		
13515	et ait pueris suis		
13516	hic est Iohannes Baptista		
13517	ipse surrexit a mortuis et ideo virtutes inoperantur in eo		
13518	Herodes enim tenuit Iohannem et alligavit eum		
13519	et posuit in carcere propter Herodiadem uxorem fratris sui		
13520	dicebat enim illi Iohannes		
13521	non licet tibi habere eam		
13522	et volens illum occidere timuit populum quia sicut prophetam eum habebant		
13524	die autem natalis Herodis saltavit filia Herodiadis in medio et placuit Herodi		
13525	unde cum iuramento pollicitus est ei dare quodcumque postulasset ab eo		
13526	at illa praemonita a matre sua da mihi inquit hic in disco caput Iohannis Baptistae		
13528	et contristatus est rex		
13529	propter iuramentum autem et eos qui pariter recumbebant iussit dari		
13530	misit que et decollavit Iohannem in carcere		
13531	et adlatum est caput eius in disco et datum est puellae et tulit matri suae		
13532	et accedentes discipuli eius tulerunt corpus et sepelierunt illud		
13533	et venientes nuntiaverunt Iesu		
13534	quod cum audisset Iesus secessit inde in navicula in locum desertum seorsum		
13535	et cum audissent turbae secutae sunt eum pedestres de civitatibus		
13536	et exiens vidit turbam multam et misertus est eius et curavit languidos eorum		
13537	vespere autem facto accesserunt ad eum discipuli eius dicentes		
13538	desertus est locus et hora iam praeteriit		
13539	dimitte turbas ut euntes in castella emant sibi escas		
13540	Iesus autem dixit eis		
13541	non habent necesse ire		
13542	date illis vos manducare		
13543	responderunt ei		
13544	non habemus hic nisi quinque panes et duos pisces		
13545	qui ait eis		
13546	adferte illos mihi huc		
13547	et cum iussisset turbam discumbere supra faenum acceptis quinque panibus et duobus piscibus aspiciens in caelum benedixit et fregit et dedit discipulis panes discipuli autem turbis		
13548	et manducaverunt omnes et saturati sunt		
13549	et tulerunt reliquias duodecim cofinos fragmentorum plenos		
13550	manducantium autem fuit numerus quinque milia virorum exceptis mulieribus et parvulis		
13551	et statim iussit discipulos ascendere in navicula et praecedere eum trans fretum donec dimitteret turbas		
13552	et dimissa turba ascendit in montem solus orare		
13553	vespere autem facto solus erat ibi		
13554	navicula autem in medio mari iactabatur fluctibus		
13555	erat enim contrarius ventus		
13556	quarta autem vigilia noctis venit ad eos ambulans supra mare		
13557	et videntes eum supra mare ambulantem turbati sunt dicentes quia		
13558	fantasma est		
13559	et prae timore clamaverunt		
13560	statim que Iesus locutus est eis dicens		
13561	habete fiduciam		
47535	ego sum		
47536	nolite timere		
13563	respondens autem Petrus dixit		
13564	Domine si tu es iube me venire ad te super aquas		
13565	at ipse ait		
13566	veni		
13567	et descendens Petrus de navicula ambulabat super aquam ut veniret ad Iesum		
13568	videns vero ventum validum timuit		
13569	et cum coepisset mergi clamavit dicens		
13570	Domine salvum me fac		
13571	et continuo Iesus extendens manum adprehendit eum		
13572	et ait illi		
13573	modicae fidei quare dubitasti		
13574	et cum ascendissent in naviculam cessavit ventus		
13575	qui autem in navicula erant venerunt et adoraverunt eum dicentes		
13576	vere Filius Dei es		
13577	et cum transfretassent venerunt in terram Gennesar		
13578	et cum cognovissent eum viri loci illius miserunt in universam regionem illam et obtulerunt ei omnes male habentes		
13579	et rogabant eum ut vel fimbriam vestimenti eius tangerent		
13580	et quicumque tetigerunt salvi facti sunt		
13581	tunc accesserunt ad eum ab Hierosolymis scribae et Pharisaei dicentes		
13582	quare discipuli tui transgrediuntur traditionem seniorum		
13583	non enim lavant manus suas cum panem manducant		
13584	ipse autem respondens ait illis		
13585	quare et vos transgredimini mandatum Dei propter traditionem vestram		
13586	nam Deus dixit		
13587	honora patrem et matrem		
13588	et qui maledixerit patri vel matri morte moriatur		
13589	vos autem dicitis		
13590	quicumque dixerit patri vel matri		
13591	munus quodcumque est ex me tibi proderit		
13592	et non honorificabit patrem suum aut matrem		
13593	et irritum fecistis mandatum Dei propter traditionem vestram		
13594	hypocritae bene prophetavit de vobis Esaias dicens		
13595	populus hic labiis me honorat		
13596	cor autem eorum longe est a me		
13597	sine causa autem colunt me docentes doctrinas mandata hominum		
13598	et convocatis ad se turbis dixit eis		
13599	audite et intellegite		
